Class,Start,End,Length,Date,File,Selection
Unknown,182.5647373,182.9533641,0.388626816,7/5/2018,2018-07-05T142500_0004e9e500057018_2.0.wav,1
Unknown,168.5347736,168.9355222,0.400748609,7/5/2018,2018-07-05T143000_0004e9e500057018_2.0.wav,1
Unknown,85.05329194,85.25458568,0.201293743,7/5/2018,2018-07-05T145000_0004e9e500057018_2.0.wav,1
Opsanus_beta,220.6408818,220.7651762,0.124294451,7/5/2018,2018-07-05T145500_0004e9e500057018_2.0.wav,1
Bairdiella_chrysoura,259.3535542,259.9335949,0.580040771,7/5/2018,2018-07-05T145500_0004e9e500057018_2.0.wav,3
Cynoscion_nebulosus,75.88525608,77.08913342,1.203877336,7/5/2018,2018-07-05T150500_0004e9e500057018_2.0.wav,1
Cynoscion_nebulosus,23.88928451,25.46180485,1.572520339,7/5/2018,2018-07-05T151500_0004e9e500057018_2.0.wav,1
Opsanus_beta,258.0750568,259.4840781,1.409021327,7/5/2018,2018-07-05T152500_0004e9e500057018_2.0.wav,1
Opsanus_beta,259.9391319,260.159553,0.220421158,7/5/2018,2018-07-05T152500_0004e9e500057018_2.0.wav,2
Opsanus_beta,260.6087658,260.7454827,0.136716921,7/5/2018,2018-07-05T152500_0004e9e500057018_2.0.wav,3
Opsanus_beta,261.8039697,261.9155753,0.11160565,7/5/2018,2018-07-05T152500_0004e9e500057018_2.0.wav,4
Opsanus_beta,263.0706899,263.1934561,0.122766214,7/5/2018,2018-07-05T152500_0004e9e500057018_2.0.wav,5
Opsanus_beta,264.4041581,264.5297145,0.125556356,7/5/2018,2018-07-05T152500_0004e9e500057018_2.0.wav,6
Opsanus_beta,266.7676685,266.8736938,0.106025367,7/5/2018,2018-07-05T152500_0004e9e500057018_2.0.wav,7
Opsanus_beta,268.3697491,268.4785646,0.108815508,7/5/2018,2018-07-05T152500_0004e9e500057018_2.0.wav,8
Opsanus_beta,269.8317831,269.9712901,0.139507062,7/5/2018,2018-07-05T152500_0004e9e500057018_2.0.wav,9
Opsanus_beta,270.2429573,270.3629334,0.119976073,7/5/2018,2018-07-05T152500_0004e9e500057018_2.0.wav,10
Opsanus_beta,270.731232,270.8372574,0.106025367,7/5/2018,2018-07-05T152500_0004e9e500057018_2.0.wav,11
Opsanus_beta,271.7217321,271.8249674,0.103235226,7/5/2018,2018-07-05T152500_0004e9e500057018_2.0.wav,12
Opsanus_beta,272.7878449,272.8854998,0.097654943,7/5/2018,2018-07-05T152500_0004e9e500057018_2.0.wav,13
Opsanus_beta,275.1787547,275.265249,0.086494378,7/5/2018,2018-07-05T152500_0004e9e500057018_2.0.wav,14
Opsanus_beta,277.7847466,277.9158832,0.131136638,7/5/2018,2018-07-05T152500_0004e9e500057018_2.0.wav,15
Opsanus_beta,279.9778351,280.0726999,0.094864802,7/5/2018,2018-07-05T152500_0004e9e500057018_2.0.wav,16
Opsanus_beta,281.4096991,281.4961934,0.086494379,7/5/2018,2018-07-05T152500_0004e9e500057018_2.0.wav,17
Opsanus_beta,282.4922739,282.5703978,0.078123955,7/5/2018,2018-07-05T152500_0004e9e500057018_2.0.wav,18
Opsanus_beta,282.930326,283.0224007,0.092074661,7/5/2018,2018-07-05T152500_0004e9e500057018_2.0.wav,19
Opsanus_beta,286.6970542,286.8198205,0.122766215,7/5/2018,2018-07-05T152500_0004e9e500057018_2.0.wav,20
Opsanus_beta,288.1776153,288.2696899,0.092074661,7/5/2018,2018-07-05T152500_0004e9e500057018_2.0.wav,21
Opsanus_beta,290.7128677,290.7909917,0.078123954,7/5/2018,2018-07-05T152500_0004e9e500057018_2.0.wav,22
Opsanus_beta,292.3892226,292.5231494,0.133926779,7/5/2018,2018-07-05T152500_0004e9e500057018_2.0.wav,23
Opsanus_beta,292.8244847,292.910979,0.086494378,7/5/2018,2018-07-05T152500_0004e9e500057018_2.0.wav,24
Opsanus_beta,294.7438786,294.9112871,0.167408474,7/5/2018,2018-07-05T152500_0004e9e500057018_2.0.wav,25
Opsanus_beta,16.02646856,16.09167221,0.065203647,7/5/2018,2018-07-05T153000_0004e9e500057018_2.0.wav,1
Opsanus_beta,21.00368024,21.09424086,0.09056062,7/5/2018,2018-07-05T153000_0004e9e500057018_2.0.wav,2
Opsanus_beta,23.92697705,24.0211601,0.094183045,7/5/2018,2018-07-05T153000_0004e9e500057018_2.0.wav,3
Opsanus_beta,26.34313439,26.41196046,0.068826071,7/5/2018,2018-07-05T153000_0004e9e500057018_2.0.wav,4
Opsanus_beta,28.76291416,28.84260751,0.079693346,7/5/2018,2018-07-05T153000_0004e9e500057018_2.0.wav,5
Opsanus_beta,30.61397323,30.6827993,0.068826071,7/5/2018,2018-07-05T153000_0004e9e500057018_2.0.wav,6
Opsanus_beta,32.93594753,33.02288572,0.086938195,7/5/2018,2018-07-05T153000_0004e9e500057018_2.0.wav,7
Opsanus_beta,37.24663304,37.32994881,0.08331577,7/5/2018,2018-07-05T153000_0004e9e500057018_2.0.wav,8
Opsanus_beta,43.90464983,44.00970014,0.105050319,7/5/2018,2018-07-05T153000_0004e9e500057018_2.0.wav,9
Opsanus_beta,46.99926697,47.09707244,0.09780547,7/5/2018,2018-07-05T153000_0004e9e500057018_2.0.wav,10
Opsanus_beta,49.165477,49.24517035,0.079693346,7/5/2018,2018-07-05T153000_0004e9e500057018_2.0.wav,11
Opsanus_beta,55.97629026,56.06685088,0.09056062,7/5/2018,2018-07-05T153000_0004e9e500057018_2.0.wav,12
Opsanus_beta,59.04999892,59.11882499,0.068826071,7/5/2018,2018-07-05T153000_0004e9e500057018_2.0.wav,13
Opsanus_beta,104.6675887,104.7047296,0.037140897,7/5/2018,2018-07-05T153000_0004e9e500057018_2.0.wav,14
Opsanus_beta,108.5875227,108.6413129,0.053790264,7/5/2018,2018-07-05T153000_0004e9e500057018_2.0.wav,15
Opsanus_beta,109.5698353,109.640275,0.070439631,7/5/2018,2018-07-05T153000_0004e9e500057018_2.0.wav,16
Opsanus_beta,115.2229359,115.2741648,0.051228823,7/5/2018,2018-07-05T153000_0004e9e500057018_2.0.wav,17
Opsanus_beta,119.5825088,119.6247725,0.042263778,7/5/2018,2018-07-05T153000_0004e9e500057018_2.0.wav,18
Opsanus_beta,125.4776655,125.5301751,0.052509543,7/5/2018,2018-07-05T153000_0004e9e500057018_2.0.wav,19
Opsanus_beta,131.8185131,131.8812684,0.062755308,7/5/2018,2018-07-05T153000_0004e9e500057018_2.0.wav,20
Cynoscion_nebulosus,47.21791081,48.59084326,1.372932452,7/5/2018,2018-07-05T154500_0004e9e500057018_2.0.wav,1
Cynoscion_nebulosus,151.0763306,151.6212162,0.544885634,8/5/2018,2018-08-05T003000_0004e9e500057018_2.0.wav,1
Cynoscion_nebulosus,151.9965608,152.1266794,0.130118652,8/5/2018,2018-08-05T003000_0004e9e500057018_2.0.wav,2
Cynoscion_nebulosus,152.4458384,152.6594294,0.213590995,8/5/2018,2018-08-05T003000_0004e9e500057018_2.0.wav,3
Unknown,276.3256278,278.0891973,1.763569549,8/5/2018,2018-08-05T004500_0004e9e500057018_2.0.wav,1
Unknown,6.040310451,8.606868415,2.566557964,8/5/2018,2018-08-05T011500_0004e9e500057018_2.0.wav,1
Cynoscion_nebulosus,29.28602017,29.51442809,0.228407918,8/5/2018,2018-08-05T023000_0004e9e500057018_2.0.wav,1
Cynoscion_nebulosus,155.9244032,157.5768523,1.652449096,8/5/2018,2018-08-05T033000_0004e9e500057018_2.0.wav,1
Cynoscion_nebulosus,11.80737458,11.97913677,0.171762194,8/5/2018,2018-08-05T040000_0004e9e500057018_2.0.wav,1
Cynoscion_nebulosus,249.2866847,249.3653337,0.078649004,8/5/2018,2018-08-05T040000_0004e9e500057018_2.0.wav,2
Cynoscion_nebulosus,250.3004409,250.9847776,0.68433674,8/5/2018,2018-08-05T040000_0004e9e500057018_2.0.wav,4
Opsanus_beta,97.04592351,97.19955483,0.153631319,8/5/2018,2018-08-05T041500_0004e9e500057018_2.0.wav,1
Opsanus_beta,101.3401233,104.4037125,3.063589248,8/5/2018,2018-08-05T041500_0004e9e500057018_2.0.wav,3
Opsanus_beta,104.7735748,104.9651621,0.191587292,8/5/2018,2018-08-05T041500_0004e9e500057018_2.0.wav,4
Opsanus_beta,105.5695859,106.001561,0.431975121,8/5/2018,2018-08-05T041500_0004e9e500057018_2.0.wav,5
Opsanus_beta,106.9888292,107.5925099,0.603680713,8/5/2018,2018-08-05T041500_0004e9e500057018_2.0.wav,6
Opsanus_beta,119.2508661,119.4189569,0.168090738,8/5/2018,2018-08-05T041500_0004e9e500057018_2.0.wav,7
Opsanus_beta,176.1462489,177.521701,1.375452164,8/5/2018,2018-08-05T041500_0004e9e500057018_2.0.wav,8
Opsanus_beta,178.3178962,179.1222013,0.804305142,8/5/2018,2018-08-05T041500_0004e9e500057018_2.0.wav,9
Opsanus_beta,179.8394287,180.6238522,0.784423442,8/5/2018,2018-08-05T041500_0004e9e500057018_2.0.wav,10
Opsanus_beta,181.8899964,182.0436277,0.153631319,8/5/2018,2018-08-05T041500_0004e9e500057018_2.0.wav,11
Opsanus_beta,183.5423888,183.6978276,0.155438746,8/5/2018,2018-08-05T041500_0004e9e500057018_2.0.wav,12
Opsanus_beta,184.9807618,185.1235486,0.142786756,8/5/2018,2018-08-05T041500_0004e9e500057018_2.0.wav,13
Opsanus_beta,190.4265217,190.5819604,0.155438747,8/5/2018,2018-08-05T041500_0004e9e500057018_2.0.wav,14
Opsanus_beta,191.337465,191.5127855,0.175320446,8/5/2018,2018-08-05T041500_0004e9e500057018_2.0.wav,15
Opsanus_beta,199.825713,201.192128,1.366415028,8/5/2018,2018-08-05T041500_0004e9e500057018_2.0.wav,16
Opsanus_beta,171.6589415,173.6117928,1.952851369,8/5/2018,2018-08-05T043000_0004e9e500057018_2.0.wav,2
Opsanus_beta,244.8990811,248.7945595,3.895478386,8/5/2018,2018-08-05T043000_0004e9e500057018_2.0.wav,3
Opsanus_beta,6.529910495,6.632104458,0.102193963,8/5/2018,2018-08-05T050000_0004e9e500057018_2.0.wav,1
Opsanus_beta,162.8858174,163.0416632,0.155845794,8/5/2018,2018-08-05T050000_0004e9e500057018_2.0.wav,2
Opsanus_beta,239.1049116,240.2954713,1.190559665,8/5/2018,2018-08-05T050000_0004e9e500057018_2.0.wav,3
Unknown,248.5178431,248.9368384,0.418995248,8/5/2018,2018-08-05T050000_0004e9e500057018_2.0.wav,4
Unknown,271.8038588,272.0184661,0.214607321,8/5/2018,2018-08-05T050000_0004e9e500057018_2.0.wav,5
Unknown,272.8283533,273.1911418,0.362788568,8/5/2018,2018-08-05T050000_0004e9e500057018_2.0.wav,6
Opsanus_beta,126.4700851,126.8868406,0.416755479,8/5/2018,2018-08-05T051500_0004e9e500057018_2.0.wav,1
Opsanus_beta,133.363455,133.5015212,0.138066233,8/5/2018,2018-08-05T051500_0004e9e500057018_2.0.wav,2
Opsanus_beta,135.1875793,135.2975209,0.10994163,8/5/2018,2018-08-05T051500_0004e9e500057018_2.0.wav,3
Opsanus_beta,139.1088297,139.3108155,0.201985785,8/5/2018,2018-08-05T051500_0004e9e500057018_2.0.wav,4
Unknown,140.699713,141.0423218,0.342608799,8/5/2018,2018-08-05T051500_0004e9e500057018_2.0.wav,6
Opsanus_beta,144.1258025,144.2868798,0.161077271,8/5/2018,2018-08-05T051500_0004e9e500057018_2.0.wav,7
Opsanus_beta,147.1453636,147.2527485,0.107384848,8/5/2018,2018-08-05T051500_0004e9e500057018_2.0.wav,8
Opsanus_beta,149.1814184,149.304144,0.12272554,8/5/2018,2018-08-05T051500_0004e9e500057018_2.0.wav,9
Opsanus_beta,154.8455485,154.9708308,0.125282322,8/5/2018,2018-08-05T051500_0004e9e500057018_2.0.wav,10
Opsanus_beta,157.6594209,158.5057157,0.846294869,8/5/2018,2018-08-05T051500_0004e9e500057018_2.0.wav,11
Opsanus_beta,160.246321,160.3562626,0.109941629,8/5/2018,2018-08-05T051500_0004e9e500057018_2.0.wav,12
Opsanus_beta,161.8783952,162.0011207,0.12272554,8/5/2018,2018-08-05T051500_0004e9e500057018_2.0.wav,13
Opsanus_beta,163.3204203,163.4405891,0.120168757,8/5/2018,2018-08-05T051500_0004e9e500057018_2.0.wav,14
Opsanus_beta,165.9908305,166.149351,0.158520489,8/5/2018,2018-08-05T051500_0004e9e500057018_2.0.wav,15
Opsanus_beta,173.5293747,173.7236901,0.194315438,8/5/2018,2018-08-05T051500_0004e9e500057018_2.0.wav,16
Opsanus_beta,179.8110908,179.9491571,0.138066233,8/5/2018,2018-08-05T051500_0004e9e500057018_2.0.wav,17
Opsanus_beta,182.6491204,182.8050841,0.155963707,8/5/2018,2018-08-05T051500_0004e9e500057018_2.0.wav,19
Opsanus_beta,186.2107194,186.4075916,0.196872221,8/5/2018,2018-08-05T051500_0004e9e500057018_2.0.wav,20
Opsanus_beta,187.7675187,187.8570061,0.089487373,8/5/2018,2018-08-05T051500_0004e9e500057018_2.0.wav,21
Opsanus_beta,190.4751524,190.6311161,0.155963707,8/5/2018,2018-08-05T051500_0004e9e500057018_2.0.wav,22
Opsanus_beta,194.9943985,195.1043401,0.109941629,8/5/2018,2018-08-05T051500_0004e9e500057018_2.0.wav,23
Opsanus_beta,197.5000464,197.6355558,0.13550945,8/5/2018,2018-08-05T051500_0004e9e500057018_2.0.wav,24
Opsanus_beta,199.7267406,199.8545798,0.127839104,8/5/2018,2018-08-05T051500_0004e9e500057018_2.0.wav,25
Opsanus_beta,202.6119025,202.7525255,0.140623015,8/5/2018,2018-08-05T051500_0004e9e500057018_2.0.wav,26
Opsanus_beta,210.0052735,210.1228855,0.117611976,8/5/2018,2018-08-05T051500_0004e9e500057018_2.0.wav,27
Opsanus_beta,211.9722862,212.2254076,0.253121427,8/5/2018,2018-08-05T051500_0004e9e500057018_2.0.wav,28
Opsanus_beta,214.4816371,214.612033,0.130395887,8/5/2018,2018-08-05T051500_0004e9e500057018_2.0.wav,29
Opsanus_beta,217.8102684,217.9611186,0.150850143,8/5/2018,2018-08-05T051500_0004e9e500057018_2.0.wav,30
Opsanus_beta,225.2533645,225.3914307,0.138066232,8/5/2018,2018-08-05T051500_0004e9e500057018_2.0.wav,31
Opsanus_beta,231.9756944,232.1265445,0.150850143,8/5/2018,2018-08-05T051500_0004e9e500057018_2.0.wav,32
Bairdiella_chrysoura,76.07866366,77.10560087,1.026937209,8/5/2018,2018-08-05T053000_0004e9e500057018_2.0.wav,1
Bairdiella_chrysoura,47.52749059,48.01159932,0.484108732,8/5/2018,2018-08-05T054500_0004e9e500057018_2.0.wav,1
Bairdiella_chrysoura,48.29700671,48.67995839,0.382951684,8/5/2018,2018-08-05T054500_0004e9e500057018_2.0.wav,3
Bairdiella_chrysoura,49.42293521,49.81672515,0.393789938,8/5/2018,2018-08-05T054500_0004e9e500057018_2.0.wav,4
Bairdiella_chrysoura,53.8359978,54.255077,0.4190792,8/5/2018,2018-08-05T054500_0004e9e500057018_2.0.wav,7
Bairdiella_chrysoura,55.86997702,56.85625824,0.986281222,8/5/2018,2018-08-05T054500_0004e9e500057018_2.0.wav,8
Bairdiella_chrysoura,58.1358905,58.57303346,0.43714296,8/5/2018,2018-08-05T054500_0004e9e500057018_2.0.wav,9
Bairdiella_chrysoura,60.30173516,60.72442712,0.422691952,8/5/2018,2018-08-05T054500_0004e9e500057018_2.0.wav,12
Bairdiella_chrysoura,62.38999653,63.55691534,1.166918808,8/5/2018,2018-08-05T054500_0004e9e500057018_2.0.wav,13
Bairdiella_chrysoura,64.64796636,65.31993819,0.671971821,8/5/2018,2018-08-05T054500_0004e9e500057018_2.0.wav,14
Bairdiella_chrysoura,74.39370318,74.85974815,0.466044973,8/5/2018,2018-08-05T054500_0004e9e500057018_2.0.wav,15
Bairdiella_chrysoura,82.9693739,83.46432089,0.494946987,8/5/2018,2018-08-05T054500_0004e9e500057018_2.0.wav,16
Opsanus_beta,129.1926611,130.0127558,0.820094643,8/5/2018,2018-08-05T054500_0004e9e500057018_2.0.wav,17
Bairdiella_chrysoura,169.2399248,169.760161,0.520236249,8/5/2018,2018-08-05T054500_0004e9e500057018_2.0.wav,18
Opsanus_beta,175.4878088,176.3801585,0.892349677,8/5/2018,2018-08-05T054500_0004e9e500057018_2.0.wav,19
Opsanus_beta,206.6643578,207.506129,0.841771153,8/5/2018,2018-08-05T054500_0004e9e500057018_2.0.wav,20
Bairdiella_chrysoura,205.4179585,205.8370377,0.4190792,8/5/2018,2018-08-05T054500_0004e9e500057018_2.0.wav,21
Bairdiella_chrysoura,274.6800379,275.1244064,0.444368462,8/5/2018,2018-08-05T054500_0004e9e500057018_2.0.wav,22
Bairdiella_chrysoura,283.2352067,283.6940262,0.45881947,8/5/2018,2018-08-05T054500_0004e9e500057018_2.0.wav,23
Bairdiella_chrysoura,287.5607923,288.1388326,0.578040276,8/5/2018,2018-08-05T054500_0004e9e500057018_2.0.wav,24
Cynoscion_nebulosus,142.0836686,142.2680191,0.184350434,8/5/2018,2018-08-05T060000_0004e9e500057018_2.0.wav,4
Opsanus_beta,93.88803927,94.70496472,0.81692545,8/5/2018,2018-08-05T060000_0004e9e500057018_2.0.wav,3
Opsanus_beta,232.7901779,233.7300036,0.939825739,8/5/2018,2018-08-05T060000_0004e9e500057018_2.0.wav,5
Opsanus_beta,241.8984009,242.7225558,0.824154879,8/5/2018,2018-08-05T060000_0004e9e500057018_2.0.wav,6
Unknown,76.8966691,76.9725781,0.075909002,8/5/2018,2018-08-05T060000_0004e9e500057018_2.0.wav,2
Unknown,257.3203592,257.7685838,0.448224583,8/5/2018,2018-08-05T060000_0004e9e500057018_2.0.wav,7
Unknown,258.715639,259.5795557,0.863916737,8/5/2018,2018-08-05T060000_0004e9e500057018_2.0.wav,8
Unknown,261.7106501,262.7155407,1.004890598,8/5/2018,2018-08-05T060000_0004e9e500057018_2.0.wav,9
Bairdiella_chrysoura,272.0763774,273.739146,1.662768615,8/5/2018,2018-08-05T060000_0004e9e500057018_2.0.wav,11
Bairdiella_chrysoura,51.76161679,52.65621296,0.894596168,8/5/2018,2018-08-05T061500_0004e9e500057018_2.0.wav,2
Cynoscion_nebulosus,67.41563034,67.73768496,0.32205462,8/5/2018,2018-08-05T061500_0004e9e500057018_2.0.wav,3
Unknown,129.214901,129.4598561,0.244955075,8/5/2018,2018-08-05T061500_0004e9e500057018_2.0.wav,4
Unknown,17.00804432,17.26372749,0.255683164,8/5/2018,2018-08-05T063000_0004e9e500057018_2.0.wav,1
Opsanus_beta,20.67610793,20.77455199,0.098444054,8/5/2018,2018-08-05T064500_0004e9e500057018_2.0.wav,1
Opsanus_beta,34.88734888,34.98579293,0.098444054,8/5/2018,2018-08-05T064500_0004e9e500057018_2.0.wav,2
Opsanus_beta,36.37976073,36.46245374,0.082693005,8/5/2018,2018-08-05T064500_0004e9e500057018_2.0.wav,3
Opsanus_beta,78.23868586,78.35288097,0.114195102,8/5/2018,2018-08-05T064500_0004e9e500057018_2.0.wav,4
Opsanus_beta,10.29433549,10.66806667,0.373731179,8/5/2018,2018-08-05T070000_0004e9e500057018_2.0.wav,1
Opsanus_beta,51.34069149,51.69456256,0.353871068,8/5/2018,2018-08-05T070000_0004e9e500057018_2.0.wav,2
Opsanus_beta,69.43030612,70.25540346,0.825097338,8/5/2018,2018-08-05T070000_0004e9e500057018_2.0.wav,3
Opsanus_beta,90.08043984,90.19779504,0.117355201,8/5/2018,2018-08-05T070000_0004e9e500057018_2.0.wav,4
Opsanus_beta,98.30172279,98.52921133,0.227488543,8/5/2018,2018-08-05T070000_0004e9e500057018_2.0.wav,5
Opsanus_beta,102.3774917,102.9371857,0.559694036,8/5/2018,2018-08-05T070000_0004e9e500057018_2.0.wav,6
Opsanus_beta,123.5385719,124.1668736,0.628301692,8/5/2018,2018-08-05T070000_0004e9e500057018_2.0.wav,7
Opsanus_beta,153.024334,153.4359799,0.411645936,8/5/2018,2018-08-05T070000_0004e9e500057018_2.0.wav,8
Opsanus_beta,190.7482693,191.3296289,0.581359611,8/5/2018,2018-08-05T070000_0004e9e500057018_2.0.wav,9
Opsanus_beta,198.9292498,199.2939536,0.364703856,8/5/2018,2018-08-05T070000_0004e9e500057018_2.0.wav,10
Opsanus_beta,211.1233991,211.3129729,0.189573787,8/5/2018,2018-08-05T070000_0004e9e500057018_2.0.wav,11
Opsanus_beta,215.7358605,216.2431961,0.507335562,8/5/2018,2018-08-05T070000_0004e9e500057018_2.0.wav,12
Opsanus_beta,225.0108668,225.8287423,0.817875478,8/5/2018,2018-08-05T070000_0004e9e500057018_2.0.wav,13
Opsanus_beta,250.0460592,250.5317291,0.485669987,8/5/2018,2018-08-05T070000_0004e9e500057018_2.0.wav,14
Opsanus_beta,291.45219,291.6146818,0.162491817,8/5/2018,2018-08-05T070000_0004e9e500057018_2.0.wav,15
Opsanus_beta,7.865074596,8.414639034,0.549564438,8/5/2018,2018-08-05T071500_0004e9e500057018_2.0.wav,1
Opsanus_beta,23.87600002,24.02062224,0.144622221,8/5/2018,2018-08-05T071500_0004e9e500057018_2.0.wav,2
Opsanus_beta,33.31601356,34.03189355,0.715879993,8/5/2018,2018-08-05T071500_0004e9e500057018_2.0.wav,3
Opsanus_beta,43.47469421,44.49428087,1.019586656,8/5/2018,2018-08-05T071500_0004e9e500057018_2.0.wav,4
Opsanus_beta,56.06138045,56.67602489,0.614644438,8/5/2018,2018-08-05T071500_0004e9e500057018_2.0.wav,5
Unknown,72.6300318,72.83250291,0.202471109,8/5/2018,2018-08-05T071500_0004e9e500057018_2.0.wav,6
Opsanus_beta,99.86890851,100.7221796,0.853271102,8/5/2018,2018-08-05T071500_0004e9e500057018_2.0.wav,7
Opsanus_beta,108.2231206,108.8233028,0.600182216,8/5/2018,2018-08-05T071500_0004e9e500057018_2.0.wav,8
Opsanus_beta,145.023292,145.5800875,0.556795549,8/5/2018,2018-08-05T071500_0004e9e500057018_2.0.wav,9
Opsanus_beta,153.6678924,154.0149858,0.34709333,8/5/2018,2018-08-05T071500_0004e9e500057018_2.0.wav,10
Opsanus_beta,182.3415281,183.4045015,1.062973322,8/5/2018,2018-08-05T071500_0004e9e500057018_2.0.wav,11
Opsanus_beta,187.0995992,187.5262347,0.426635551,8/5/2018,2018-08-05T071500_0004e9e500057018_2.0.wav,12
Opsanus_beta,230.3668609,231.5383008,1.171439988,8/5/2018,2018-08-05T071500_0004e9e500057018_2.0.wav,13
Opsanus_beta,257.4093719,258.132483,0.723111104,8/5/2018,2018-08-05T071500_0004e9e500057018_2.0.wav,14
Opsanus_beta,283.4107919,283.7795786,0.368786663,8/5/2018,2018-08-05T071500_0004e9e500057018_2.0.wav,15
Opsanus_beta,0.112496231,0.859062126,0.746565895,8/5/2018,2018-08-05T073000_0004e9e500057018_2.0.wav,1
Opsanus_beta,126.9613921,127.3755828,0.414190668,8/5/2018,2018-08-05T073000_0004e9e500057018_2.0.wav,2
Opsanus_beta,225.2157374,226.2588843,1.043146867,8/5/2018,2018-08-05T073000_0004e9e500057018_2.0.wav,3
Bairdiella_chrysoura,129.1660316,130.1189098,0.952878216,8/5/2018,2018-08-05T081500_0004e9e500057018_2.0.wav,1
Opsanus_beta,242.0787405,243.089369,1.010628411,8/5/2018,2018-08-05T081500_0004e9e500057018_2.0.wav,2
Opsanus_beta,3.521755891,4.273835178,0.752079287,8/5/2018,2018-08-05T083000_0004e9e500057018_2.0.wav,1
Opsanus_beta,16.25200711,16.38940621,0.1373991,8/5/2018,2018-08-05T083000_0004e9e500057018_2.0.wav,2
Opsanus_beta,41.89329555,42.70322708,0.809931539,8/5/2018,2018-08-05T083000_0004e9e500057018_2.0.wav,3
Opsanus_beta,193.6246894,194.4635471,0.838857666,8/5/2018,2018-08-05T083000_0004e9e500057018_2.0.wav,4
Opsanus_beta,9.216823712,9.910049769,0.693226057,8/5/2018,2018-08-05T090000_0004e9e500057018_2.0.wav,1
Opsanus_beta,63.49406188,64.25688895,0.762827067,8/5/2018,2018-08-05T090000_0004e9e500057018_2.0.wav,2
Opsanus_beta,81.88356612,82.09793723,0.21437111,8/5/2018,2018-08-05T090000_0004e9e500057018_2.0.wav,3
Bairdiella_chrysoura,111.9394833,112.3208969,0.381413534,8/5/2018,2018-08-05T090000_0004e9e500057018_2.0.wav,4
Opsanus_beta,152.3688234,153.1511388,0.782315349,8/5/2018,2018-08-05T090000_0004e9e500057018_2.0.wav,5
Opsanus_beta,200.0947689,200.9383331,0.843564238,8/5/2018,2018-08-05T090000_0004e9e500057018_2.0.wav,6
Opsanus_beta,214.9485175,215.3772597,0.42874222,8/5/2018,2018-08-05T090000_0004e9e500057018_2.0.wav,7
Opsanus_beta,238.6639442,238.9117238,0.247779594,8/5/2018,2018-08-05T090000_0004e9e500057018_2.0.wav,8
Opsanus_beta,254.5513657,254.8019293,0.250563635,8/5/2018,2018-08-05T090000_0004e9e500057018_2.0.wav,9
Opsanus_beta,282.4019061,282.7248548,0.322948685,8/5/2018,2018-08-05T090000_0004e9e500057018_2.0.wav,10
Opsanus_beta,57.3160248,58.13405649,0.818031684,8/5/2018,2018-08-05T091500_0004e9e500057018_2.0.wav,1
Opsanus_beta,67.36094128,67.77830438,0.417363105,8/5/2018,2018-08-05T091500_0004e9e500057018_2.0.wav,2
Cynoscion_nebulosus,168.9323792,170.1900334,1.257654154,8/5/2018,2018-08-05T091500_0004e9e500057018_2.0.wav,3
Opsanus_beta,272.3067168,272.9244142,0.617697394,8/5/2018,2018-08-05T091500_0004e9e500057018_2.0.wav,4
Opsanus_beta,236.6261668,237.7624078,1.136240925,8/5/2018,2018-08-05T093000_0004e9e500057018_2.0.wav,1
Opsanus_beta,177.3419393,178.3029209,0.960981636,8/5/2018,2018-08-05T094500_0004e9e500057018_2.0.wav,1
Opsanus_beta,199.7501612,200.6875121,0.93735094,8/5/2018,2018-08-05T094500_0004e9e500057018_2.0.wav,2
Bairdiella_chrysoura,249.5088988,250.7692026,1.260303785,8/5/2018,2018-08-05T094500_0004e9e500057018_2.0.wav,4
Opsanus_beta,265.0752519,265.4848506,0.40959873,8/5/2018,2018-08-05T094500_0004e9e500057018_2.0.wav,5
Opsanus_beta,284.5436514,284.7169432,0.17329177,8/5/2018,2018-08-05T094500_0004e9e500057018_2.0.wav,6
Opsanus_beta,4.220441533,5.467643253,1.24720172,8/5/2018,2018-08-05T100000_0004e9e500057018_2.0.wav,1
Cynoscion_nebulosus,85.52689757,87.64338375,2.11648618,8/5/2018,2018-08-05T101500_0004e9e500057018_2.0.wav,1
Bairdiella_chrysoura,128.0903605,129.159743,1.069382491,8/5/2018,2018-08-05T101500_0004e9e500057018_2.0.wav,2
Bairdiella_chrysoura,167.7070021,170.425016,2.718013832,8/5/2018,2018-08-05T101500_0004e9e500057018_2.0.wav,3
Opsanus_beta,188.0074971,189.032322,1.024824887,8/5/2018,2018-08-05T101500_0004e9e500057018_2.0.wav,4
Opsanus_beta,260.9557597,261.3456387,0.389879034,8/5/2018,2018-08-05T101500_0004e9e500057018_2.0.wav,5
Opsanus_beta,266.99979,267.8463845,0.846594472,8/5/2018,2018-08-05T101500_0004e9e500057018_2.0.wav,6
Cynoscion_nebulosus,63.65883316,65.19434195,1.535508792,8/5/2018,2018-08-05T103000_0004e9e500057018_2.0.wav,1
Opsanus_beta,89.85501456,91.12347835,1.268463785,8/5/2018,2018-08-05T103000_0004e9e500057018_2.0.wav,2
Bairdiella_chrysoura,28.53464451,29.10177022,0.567125708,8/5/2018,2018-08-05T104500_0004e9e500057018_2.0.wav,1
Unknown,111.784443,112.1517296,0.367286659,8/5/2018,2018-08-05T124500_0004e9e500057018_2.0.wav,1
Opsanus_beta,92.55538195,93.54394628,0.988564335,8/5/2018,2018-08-05T130000_0004e9e500057018_2.0.wav,1
Cynoscion_nebulosus,266.0667894,267.6457076,1.578918247,8/5/2018,2018-08-05T130000_0004e9e500057018_2.0.wav,2
Opsanus_beta,121.6286712,122.2914142,0.662742958,8/5/2018,2018-08-05T134500_0004e9e500057018_2.0.wav,1
Opsanus_beta,86.66601096,87.61420199,0.948191029,8/5/2018,2018-08-05T141500_0004e9e500057018_2.0.wav,1
Opsanus_beta,68.07856932,69.09740954,1.01884022,8/5/2018,2018-08-05T143000_0004e9e500057018_2.0.wav,1
Opsanus_beta,176.4987575,177.2726307,0.773873173,8/5/2018,2018-08-05T143000_0004e9e500057018_2.0.wav,2
Cynoscion_nebulosus,0.751749214,2.107682056,1.355932842,8/5/2018,2018-08-05T150000_0004e9e500057018_2.0.wav,1
Cynoscion_nebulosus,3.045976446,3.307696542,0.261720096,8/5/2018,2018-08-05T150000_0004e9e500057018_2.0.wav,2
Opsanus_beta,268.1238808,268.9870003,0.863119468,8/5/2018,2018-08-05T150000_0004e9e500057018_2.0.wav,3
Opsanus_beta,122.8676196,123.6875737,0.819954099,8/5/2018,2018-08-05T151500_0004e9e500057018_2.0.wav,1
Opsanus_beta,9.145872124,9.40175222,0.255880096,8/5/2018,2018-08-05T153000_0004e9e500057018_2.0.wav,1
Opsanus_beta,23.78221404,24.54985432,0.767640286,8/5/2018,2018-08-05T153000_0004e9e500057018_2.0.wav,2
Opsanus_beta,57.57019767,58.46380969,0.893612025,8/5/2018,2018-08-05T153000_0004e9e500057018_2.0.wav,3
Opsanus_beta,63.78917263,63.83153146,0.042358829,8/5/2018,2018-08-05T154500_0004e9e500057018_2.0.wav,1
Opsanus_beta,71.46270844,72.20022271,0.737514274,8/5/2018,2018-08-05T154500_0004e9e500057018_2.0.wav,2
Opsanus_beta,147.7634932,148.6101424,0.846649279,8/5/2018,2018-08-05T154500_0004e9e500057018_2.0.wav,3
Opsanus_beta,194.9468837,195.7136604,0.766776705,8/5/2018,2018-08-05T154500_0004e9e500057018_2.0.wav,4
Bairdiella_chrysoura,214.2866957,215.527383,1.240687308,8/5/2018,2018-08-05T154500_0004e9e500057018_2.0.wav,5
Opsanus_beta,252.1888935,252.9130715,0.724178,8/5/2018,2018-08-05T154500_0004e9e500057018_2.0.wav,6
Opsanus_beta,21.16364483,21.99417432,0.830529493,8/5/2018,2018-08-05T160000_0004e9e500057018_2.0.wav,1
Unknown,54.43993195,54.63673988,0.196807936,8/5/2018,2018-08-05T160000_0004e9e500057018_2.0.wav,2
Opsanus_beta,74.50932202,75.24045969,0.731137673,8/5/2018,2018-08-05T161500_0004e9e500057018_2.0.wav,1
Opsanus_beta,73.49621583,74.33649058,0.840274745,8/5/2018,2018-08-05T163000_0004e9e500057018_2.0.wav,1
Opsanus_beta,231.8824395,232.8980034,1.015563847,8/5/2018,2018-08-05T163000_0004e9e500057018_2.0.wav,2
Unknown,290.223103,290.359439,0.136335969,8/5/2018,2018-08-05T163000_0004e9e500057018_2.0.wav,3
Opsanus_beta,292.7133212,293.5118604,0.798539179,8/5/2018,2018-08-05T163000_0004e9e500057018_2.0.wav,4
Opsanus_beta,3.09591295,4.075914171,0.980001221,8/5/2018,2018-08-05T164500_0004e9e500057018_2.0.wav,1
Opsanus_beta,202.19207,203.1163893,0.924319334,8/5/2018,2018-08-05T164500_0004e9e500057018_2.0.wav,2
Unknown,222.460277,222.7386865,0.278409438,8/5/2018,2018-08-05T164500_0004e9e500057018_2.0.wav,3
Opsanus_beta,9.869921502,10.74897877,0.879057271,8/5/2018,2018-08-05T170000_0004e9e500057018_2.0.wav,1
Opsanus_beta,112.9199136,113.7322071,0.812293427,8/5/2018,2018-08-05T170000_0004e9e500057018_2.0.wav,2
Opsanus_beta,187.5285085,188.4186931,0.890184578,8/5/2018,2018-08-05T170000_0004e9e500057018_2.0.wav,3
Opsanus_beta,257.9643632,258.8211659,0.856802656,8/5/2018,2018-08-05T170000_0004e9e500057018_2.0.wav,4
Opsanus_beta,79.36714753,80.2399188,0.872771275,8/5/2018,2018-08-05T171500_0004e9e500057018_2.0.wav,1
Opsanus_beta,166.2589991,167.1317704,0.872771275,8/5/2018,2018-08-05T171500_0004e9e500057018_2.0.wav,2
Opsanus_beta,260.620515,261.4932862,0.872771275,8/5/2018,2018-08-05T171500_0004e9e500057018_2.0.wav,3
Opsanus_beta,39.33356233,40.00196551,0.668403186,8/5/2018,2018-08-05T173000_0004e9e500057018_2.0.wav,1
Opsanus_beta,93.96176245,94.79530054,0.833538092,8/5/2018,2018-08-05T173000_0004e9e500057018_2.0.wav,2
Unknown,130.7789834,131.0384811,0.259497708,8/5/2018,2018-08-05T173000_0004e9e500057018_2.0.wav,3
Opsanus_beta,175.664224,176.552807,0.88858306,8/5/2018,2018-08-05T173000_0004e9e500057018_2.0.wav,4
Cynoscion_nebulosus,212.1747658,212.371355,0.196589173,8/5/2018,2018-08-05T173000_0004e9e500057018_2.0.wav,5
Opsanus_beta,13.30309081,14.05787609,0.754785284,8/5/2018,2018-08-05T174500_0004e9e500057018_2.0.wav,1
Opsanus_beta,39.40608236,40.18445469,0.778372324,8/5/2018,2018-08-05T174500_0004e9e500057018_2.0.wav,2
Opsanus_beta,91.94228389,92.8700408,0.927756911,8/5/2018,2018-08-05T174500_0004e9e500057018_2.0.wav,3
Opsanus_beta,258.2230572,259.0171542,0.794097017,8/5/2018,2018-08-05T174500_0004e9e500057018_2.0.wav,4
Opsanus_beta,25.87966611,26.76854217,0.88887606,8/5/2018,2018-08-05T180000_0004e9e500057018_2.0.wav,1
Opsanus_beta,50.08384018,50.48501433,0.401174151,8/5/2018,2018-08-05T180000_0004e9e500057018_2.0.wav,2
Opsanus_beta,65.24193041,65.65097072,0.409040311,8/5/2018,2018-08-05T180000_0004e9e500057018_2.0.wav,3
Opsanus_beta,150.1885916,150.9830737,0.794482142,8/5/2018,2018-08-05T180000_0004e9e500057018_2.0.wav,4
Opsanus_beta,175.9659978,176.6975507,0.731552863,8/5/2018,2018-08-05T180000_0004e9e500057018_2.0.wav,5
Opsanus_beta,251.4024719,252.2520172,0.849545261,8/5/2018,2018-08-05T180000_0004e9e500057018_2.0.wav,6
Opsanus_beta,26.80597585,27.67516965,0.869193807,8/5/2018,2018-08-05T181500_0004e9e500057018_2.0.wav,1
Cynoscion_nebulosus,62.68958926,62.79455509,0.104965835,8/5/2018,2018-08-05T181500_0004e9e500057018_2.0.wav,2
Cynoscion_nebulosus,63.40555025,63.4995495,0.093999255,8/5/2018,2018-08-05T181500_0004e9e500057018_2.0.wav,3
Opsanus_beta,125.6847562,126.587149,0.902392846,8/5/2018,2018-08-05T181500_0004e9e500057018_2.0.wav,4
Opsanus_beta,183.5569636,183.9329606,0.375997019,8/5/2018,2018-08-05T181500_0004e9e500057018_2.0.wav,5
Opsanus_beta,205.7846541,206.7371798,0.952525782,8/5/2018,2018-08-05T181500_0004e9e500057018_2.0.wav,6
Opsanus_beta,264.2897901,265.0355175,0.745727422,8/5/2018,2018-08-05T181500_0004e9e500057018_2.0.wav,7
Opsanus_beta,68.13613036,68.19655995,0.060429593,8/5/2018,2018-08-05T183000_0004e9e500057018_2.0.wav,1
Opsanus_beta,75.78181133,76.58586082,0.80404949,8/5/2018,2018-08-05T183000_0004e9e500057018_2.0.wav,2
Unknown,77.70864016,77.78053385,0.071893692,8/5/2018,2018-08-05T183000_0004e9e500057018_2.0.wav,3
Unknown,165.1266279,165.5058474,0.379219479,8/5/2018,2018-08-05T183000_0004e9e500057018_2.0.wav,4
Opsanus_beta,265.3416949,266.1506964,0.809001555,8/5/2018,2018-08-05T183000_0004e9e500057018_2.0.wav,5
Opsanus_beta,230.601808,231.4911239,0.889315912,8/5/2018,2018-08-05T184500_0004e9e500057018_2.0.wav,1
Opsanus_beta,12.78599048,13.09686177,0.310871285,8/5/2018,2018-08-05T190000_0004e9e500057018_2.0.wav,1
Opsanus_beta,25.86687133,26.12916898,0.262297647,8/5/2018,2018-08-05T190000_0004e9e500057018_2.0.wav,2
Opsanus_beta,42.736496,42.99393628,0.257440283,8/5/2018,2018-08-05T190000_0004e9e500057018_2.0.wav,3
Opsanus_beta,91.70843867,92.32532388,0.616885207,8/5/2018,2018-08-05T190000_0004e9e500057018_2.0.wav,4
Opsanus_beta,112.7262523,113.0808399,0.35458756,8/5/2018,2018-08-05T190000_0004e9e500057018_2.0.wav,5
Opsanus_beta,126.6425998,127.4489222,0.806322395,8/5/2018,2018-08-05T190000_0004e9e500057018_2.0.wav,6
Opsanus_beta,171.0777645,171.6752203,0.597455751,8/5/2018,2018-08-05T190000_0004e9e500057018_2.0.wav,7
Opsanus_beta,192.7027486,193.3439206,0.641172026,8/5/2018,2018-08-05T190000_0004e9e500057018_2.0.wav,8
Opsanus_beta,213.0282691,213.7604952,0.732226161,8/5/2018,2018-08-05T190000_0004e9e500057018_2.0.wav,10
Opsanus_beta,239.5299886,239.8195428,0.28955415,8/5/2018,2018-08-05T190000_0004e9e500057018_2.0.wav,11
Opsanus_beta,268.3381727,268.9908965,0.652723764,8/5/2018,2018-08-05T190000_0004e9e500057018_2.0.wav,12
Opsanus_beta,292.842306,293.5588298,0.71652383100000006,8/5/2018,2018-08-05T190000_0004e9e500057018_2.0.wav,13
Opsanus_beta,17.77503751,18.10732897,0.332291464,8/5/2018,2018-08-05T191500_0004e9e500057018_2.0.wav,1
Opsanus_beta,47.46144595,48.19759935,0.736153396,8/5/2018,2018-08-05T191500_0004e9e500057018_2.0.wav,2
Opsanus_beta,67.06153052,67.49606551,0.43453499,8/5/2018,2018-08-05T191500_0004e9e500057018_2.0.wav,3
Bairdiella_chrysoura,75.19847685,75.29213471,0.093657856,8/5/2018,2018-08-05T191500_0004e9e500057018_2.0.wav,4
Opsanus_beta,110.8153508,111.5106068,0.695255985,8/5/2018,2018-08-05T191500_0004e9e500057018_2.0.wav,6
Bairdiella_chrysoura,113.5950967,113.7101207,0.115023968,8/5/2018,2018-08-05T191500_0004e9e500057018_2.0.wav,7
Opsanus_beta,121.7183451,122.122207,0.403861932,8/5/2018,2018-08-05T191500_0004e9e500057018_2.0.wav,8
Opsanus_beta,139.7029815,140.4595836,0.756602101,8/5/2018,2018-08-05T191500_0004e9e500057018_2.0.wav,9
Opsanus_beta,232.908182,233.6647841,0.756602102,8/5/2018,2018-08-05T191500_0004e9e500057018_2.0.wav,10
Opsanus_beta,67.88066823,68.87803921,0.997370977,8/5/2018,2018-08-05T193000_0004e9e500057018_2.0.wav,1
Opsanus_beta,186.4337681,187.3474234,0.913655287,8/5/2018,2018-08-05T193000_0004e9e500057018_2.0.wav,2
Unknown,206.4294946,206.6103222,0.180827609,8/5/2018,2018-08-05T193000_0004e9e500057018_2.0.wav,3
Bairdiella_chrysoura,249.1619135,249.4426722,0.280758656,8/5/2018,2018-08-05T193000_0004e9e500057018_2.0.wav,4
Opsanus_beta,253.125845,253.9252934,0.799448376,8/5/2018,2018-08-05T193000_0004e9e500057018_2.0.wav,5
Bairdiella_chrysoura,263.98026,264.1372945,0.157034502,8/5/2018,2018-08-05T193000_0004e9e500057018_2.0.wav,6
Opsanus_beta,4.607509594,5.247140345,0.639630751,8/5/2018,2018-08-05T194500_0004e9e500057018_2.0.wav,1
Opsanus_beta,49.77555794,50.43687109,0.661313149,8/5/2018,2018-08-05T194500_0004e9e500057018_2.0.wav,2
Opsanus_beta,138.293947,139.1251056,0.831158603,8/5/2018,2018-08-05T194500_0004e9e500057018_2.0.wav,3
Opsanus_beta,199.4383091,200.32006,0.881750865,8/5/2018,2018-08-05T194500_0004e9e500057018_2.0.wav,4
Cynoscion_nebulosus,253.6947748,253.8043816,0.109606803,8/5/2018,2018-08-05T194500_0004e9e500057018_2.0.wav,5
Opsanus_beta,267.9984618,268.8902626,0.891800799,8/5/2018,2018-08-05T194500_0004e9e500057018_2.0.wav,6
Opsanus_beta,19.58263301,20.41271146,0.830078443,8/5/2018,2018-08-05T200000_0004e9e500057018_2.0.wav,1
Opsanus_beta,66.1247698,66.82492292,0.700153122,8/5/2018,2018-08-05T200000_0004e9e500057018_2.0.wav,2
Unknown,90.17539019,91.27253735,1.097147159,8/5/2018,2018-08-05T200000_0004e9e500057018_2.0.wav,3
Bairdiella_chrysoura,128.6044125,132.1340504,3.529637901,8/5/2018,2018-08-05T200000_0004e9e500057018_2.0.wav,4
Unknown,81.70897501,81.76317785,0.054202842,8/5/2018,2018-08-05T201500_0004e9e500057018_2.0.wav,1
Cynoscion_nebulosus,151.0163401,151.3776924,0.361352277,8/5/2018,2018-08-05T201500_0004e9e500057018_2.0.wav,2
Cynoscion_nebulosus,156.2089723,156.5486434,0.339671141,8/5/2018,2018-08-05T201500_0004e9e500057018_2.0.wav,3
Cynoscion_nebulosus,164.3701133,164.8760065,0.505893188,8/5/2018,2018-08-05T201500_0004e9e500057018_2.0.wav,4
Cynoscion_nebulosus,168.0089307,168.4931427,0.484212052,8/5/2018,2018-08-05T201500_0004e9e500057018_2.0.wav,5
Cynoscion_nebulosus,174.8457156,175.2287491,0.383033413,8/5/2018,2018-08-05T201500_0004e9e500057018_2.0.wav,6
Opsanus_beta,289.5606073,290.5218044,0.961197057,8/5/2018,2018-08-05T201500_0004e9e500057018_2.0.wav,7
Opsanus_beta,39.00296234,39.95890341,0.955941074,8/5/2018,2018-08-05T203000_0004e9e500057018_2.0.wav,1
Opsanus_beta,144.6847639,144.9174601,0.232696182,8/5/2018,2018-08-05T203000_0004e9e500057018_2.0.wav,2
Cynoscion_nebulosus,240.4801224,244.4107892,3.930666841,8/5/2018,2018-08-05T203000_0004e9e500057018_2.0.wav,3
Cynoscion_nebulosus,245.7692318,248.0458809,2.276649138,8/5/2018,2018-08-05T203000_0004e9e500057018_2.0.wav,4
Cynoscion_nebulosus,255.7548622,260.4986859,4.743823687,8/5/2018,2018-08-05T203000_0004e9e500057018_2.0.wav,5
Opsanus_beta,282.2139473,283.1340855,0.920138216,8/5/2018,2018-08-05T203000_0004e9e500057018_2.0.wav,7
Unknown,33.67004417,33.81062356,0.140579398,8/5/2018,2018-08-05T204500_0004e9e500057018_2.0.wav,1
Cynoscion_nebulosus,60.79624239,60.88751393,0.091271538,8/5/2018,2018-08-05T204500_0004e9e500057018_2.0.wav,2
Opsanus_beta,253.3999805,254.2006397,0.800659235,8/5/2018,2018-08-05T204500_0004e9e500057018_2.0.wav,3
Opsanus_beta,10.35192337,11.059377,0.707453626,8/5/2018,2018-08-05T210000_0004e9e500057018_2.0.wav,1
Bairdiella_chrysoura,129.5867333,129.695017,0.108283718,8/5/2018,2018-08-05T210000_0004e9e500057018_2.0.wav,2
Cynoscion_nebulosus,70.46475362,70.68444504,0.219691415,8/5/2018,2018-08-05T211500_0004e9e500057018_2.0.wav,1
Opsanus_beta,20.19119186,20.87563903,0.684447168,8/5/2018,2018-08-05T213000_0004e9e500057018_2.0.wav,1
Opsanus_beta,44.47374325,44.76999651,0.296253252,8/5/2018,2018-08-05T213000_0004e9e500057018_2.0.wav,2
Unknown,90.5258012,91.03658267,0.510781468,8/5/2018,2018-08-05T213000_0004e9e500057018_2.0.wav,3
Cynoscion_nebulosus,102.1103251,103.4383569,1.328031819,8/5/2018,2018-08-05T213000_0004e9e500057018_2.0.wav,4
Opsanus_beta,107.4037252,107.6846551,0.280929808,8/5/2018,2018-08-05T213000_0004e9e500057018_2.0.wav,5
Opsanus_beta,120.3418201,120.9854048,0.64358465,8/5/2018,2018-08-05T213000_0004e9e500057018_2.0.wav,6
Opsanus_beta,146.9790737,147.7299225,0.75084876,8/5/2018,2018-08-05T213000_0004e9e500057018_2.0.wav,7
Opsanus_beta,163.7378139,164.0698219,0.332007954,8/5/2018,2018-08-05T213000_0004e9e500057018_2.0.wav,8
Cynoscion_nebulosus,233.5820728,233.7710619,0.188989143,8/5/2018,2018-08-05T213000_0004e9e500057018_2.0.wav,9
Cynoscion_nebulosus,217.5241652,217.6777649,0.153599655,8/5/2018,2018-08-05T220000_0004e9e500057018_2.0.wav,1
Cynoscion_nebulosus,223.7224856,223.8854893,0.163003716,8/5/2018,2018-08-05T220000_0004e9e500057018_2.0.wav,2
Bairdiella_chrysoura,144.9428046,145.1080174,0.165212841,8/5/2018,2018-08-05T221500_0004e9e500057018_2.0.wav,1
Opsanus_beta,185.2811309,185.4491833,0.168052401,8/5/2018,2018-08-05T223000_0004e9e500057018_2.0.wav,1
Opsanus_beta,198.6312136,198.8597648,0.228551265,8/5/2018,2018-08-05T223000_0004e9e500057018_2.0.wav,2
Opsanus_beta,201.1251111,201.6158242,0.49071301,8/5/2018,2018-08-05T223000_0004e9e500057018_2.0.wav,3
Cynoscion_nebulosus,210.717542,210.9057607,0.188218689,8/5/2018,2018-08-05T223000_0004e9e500057018_2.0.wav,4
Cynoscion_nebulosus,213.6887085,213.7895399,0.100831441,8/5/2018,2018-08-05T223000_0004e9e500057018_2.0.wav,5
Cynoscion_nebulosus,238.5066867,238.943623,0.436936243,8/5/2018,2018-08-05T223000_0004e9e500057018_2.0.wav,6
Opsanus_beta,28.01092442,28.26138706,0.25046264,8/5/2018,2018-08-05T224500_0004e9e500057018_2.0.wav,1
Opsanus_beta,44.89926281,45.17017138,0.27090857,8/5/2018,2018-08-05T224500_0004e9e500057018_2.0.wav,2
Opsanus_beta,70.81959091,71.668097,0.848506088,8/5/2018,2018-08-05T224500_0004e9e500057018_2.0.wav,3
Opsanus_beta,146.8426712,147.1186912,0.276020053,8/5/2018,2018-08-05T224500_0004e9e500057018_2.0.wav,4
Unknown,184.5020636,184.628158,0.126094406,8/5/2018,2018-08-05T224500_0004e9e500057018_2.0.wav,5
Opsanus_beta,189.0567464,189.72925,0.672503502,8/5/2018,2018-08-05T224500_0004e9e500057018_2.0.wav,6
Bairdiella_chrysoura,208.7924321,208.8573898,0.064957724,8/5/2018,2018-08-05T224500_0004e9e500057018_2.0.wav,7
Cynoscion_nebulosus,214.2985547,214.4513964,0.152841705,8/5/2018,2018-08-05T224500_0004e9e500057018_2.0.wav,8
Unknown,285.7444109,286.111231,0.366820092,8/5/2018,2018-08-05T224500_0004e9e500057018_2.0.wav,9
Cynoscion_nebulosus,4.823849644,6.93493284,2.111083196,8/5/2018,2018-08-05T230000_0004e9e500057018_2.0.wav,1
Cynoscion_nebulosus,13.70593346,14.2625563,0.556622836,8/5/2018,2018-08-05T230000_0004e9e500057018_2.0.wav,2
Bairdiella_chrysoura,162.7941054,163.0832601,0.28915472,8/5/2018,2018-08-05T230000_0004e9e500057018_2.0.wav,3
Cynoscion_nebulosus,192.9817168,193.9006774,0.918960564,8/5/2018,2018-08-05T231500_0004e9e500057018_2.0.wav,1
Bairdiella_chrysoura,136.8426311,137.0955482,0.252917154,8/5/2018,2018-08-05T234500_0004e9e500057018_2.0.wav,1
Bairdiella_chrysoura,255.0416551,255.287346,0.24569095,8/5/2018,2018-08-05T234500_0004e9e500057018_2.0.wav,2
Unknown,22.63934276,22.79815211,0.158809351,8/6/2018,2018-08-06T000000_0004e9e500057018_2.0.wav,1
Opsanus_beta,132.4483237,133.2679848,0.819661165,8/6/2018,2018-08-06T000000_0004e9e500057018_2.0.wav,2
Cynoscion_nebulosus,213.4513371,213.6869897,0.235652585,8/6/2018,2018-08-06T000000_0004e9e500057018_2.0.wav,3
Bairdiella_chrysoura,270.2771594,270.4206001,0.143440704,8/6/2018,2018-08-06T000000_0004e9e500057018_2.0.wav,4
Cynoscion_nebulosus,273.0332701,273.3099057,0.276635643,8/6/2018,2018-08-06T000000_0004e9e500057018_2.0.wav,5
Cynoscion_nebulosus,274.8877535,275.04144,0.153686469,8/6/2018,2018-08-06T000000_0004e9e500057018_2.0.wav,6
Unknown,270.7484646,270.9021511,0.153686469,8/6/2018,2018-08-06T000000_0004e9e500057018_2.0.wav,7
Cynoscion_nebulosus,5.962902143,7.67972741,1.716825267,8/6/2018,2018-08-06T001500_0004e9e500057018_2.0.wav,1
Cynoscion_nebulosus,17.15803382,17.30110259,0.143068772,8/6/2018,2018-08-06T001500_0004e9e500057018_2.0.wav,2
Opsanus_beta,42.13375428,42.79289255,0.659138272,8/6/2018,2018-08-06T001500_0004e9e500057018_2.0.wav,3
Opsanus_beta,52.27119891,52.47558287,0.20438396,8/6/2018,2018-08-06T001500_0004e9e500057018_2.0.wav,4
Opsanus_beta,74.94759981,75.17242217,0.224822357,8/6/2018,2018-08-06T001500_0004e9e500057018_2.0.wav,5
Cynoscion_nebulosus,82.91346487,83.12806803,0.214603158,8/6/2018,2018-08-06T001500_0004e9e500057018_2.0.wav,6
Cynoscion_nebulosus,84.50255016,84.60985174,0.107301579,8/6/2018,2018-08-06T001500_0004e9e500057018_2.0.wav,7
Cynoscion_nebulosus,94.51736447,94.62977565,0.112411178,8/6/2018,2018-08-06T001500_0004e9e500057018_2.0.wav,8
Opsanus_beta,121.2048006,121.9456925,0.740891857,8/6/2018,2018-08-06T001500_0004e9e500057018_2.0.wav,9
Opsanus_beta,161.8363325,162.5516764,0.715343861,8/6/2018,2018-08-06T001500_0004e9e500057018_2.0.wav,10
Opsanus_beta,191.3033907,191.579309,0.275918346,8/6/2018,2018-08-06T001500_0004e9e500057018_2.0.wav,11
Opsanus_beta,229.5538496,230.3969335,0.843083836,8/6/2018,2018-08-06T001500_0004e9e500057018_2.0.wav,12
Opsanus_beta,242.895013,243.1709313,0.275918346,8/6/2018,2018-08-06T001500_0004e9e500057018_2.0.wav,13
Opsanus_beta,260.7990481,261.386652,0.587603886,8/6/2018,2018-08-06T001500_0004e9e500057018_2.0.wav,14
Opsanus_beta,24.30399232,24.58533863,0.281346309,8/6/2018,2018-08-06T003000_0004e9e500057018_2.0.wav,1
Opsanus_beta,28.44483287,28.71896517,0.274132301,8/6/2018,2018-08-06T003000_0004e9e500057018_2.0.wav,2
Opsanus_beta,45.39053717,45.66466947,0.274132302,8/6/2018,2018-08-06T003000_0004e9e500057018_2.0.wav,3
Unknown,49.53859166,49.71894185,0.180350198,8/6/2018,2018-08-06T003000_0004e9e500057018_2.0.wav,4
Opsanus_beta,57.6471365,57.99340888,0.346272381,8/6/2018,2018-08-06T003000_0004e9e500057018_2.0.wav,5
Opsanus_beta,64.15417154,64.97656845,0.822396904,8/6/2018,2018-08-06T003000_0004e9e500057018_2.0.wav,6
Cynoscion_nebulosus,65.64025717,67.09027277,1.450015592,8/6/2018,2018-08-06T003000_0004e9e500057018_2.0.wav,7
Opsanus_beta,85.73848276,86.01261506,0.274132301,8/6/2018,2018-08-06T003000_0004e9e500057018_2.0.wav,8
Opsanus_beta,140.2042419,140.4928022,0.288560317,8/6/2018,2018-08-06T003000_0004e9e500057018_2.0.wav,9
Cynoscion_nebulosus,149.6401642,151.6745144,2.034350234,8/6/2018,2018-08-06T003000_0004e9e500057018_2.0.wav,10
Opsanus_beta,159.682063,159.9706233,0.288560317,8/6/2018,2018-08-06T003000_0004e9e500057018_2.0.wav,11
Opsanus_beta,165.0709268,165.287347,0.216420238,8/6/2018,2018-08-06T003000_0004e9e500057018_2.0.wav,12
Opsanus_beta,203.1320322,203.4494486,0.317416349,8/6/2018,2018-08-06T003000_0004e9e500057018_2.0.wav,13
Opsanus_beta,225.8850129,226.1086472,0.223634246,8/6/2018,2018-08-06T003000_0004e9e500057018_2.0.wav,14
Opsanus_beta,232.2116978,232.9691686,0.757470832,8/6/2018,2018-08-06T003000_0004e9e500057018_2.0.wav,15
Opsanus_beta,234.15948,234.4985383,0.339058372,8/6/2018,2018-08-06T003000_0004e9e500057018_2.0.wav,16
Opsanus_beta,236.3741804,236.7853788,0.411198452,8/6/2018,2018-08-06T003000_0004e9e500057018_2.0.wav,17
Opsanus_beta,238.7115189,238.884655,0.17313619,8/6/2018,2018-08-06T003000_0004e9e500057018_2.0.wav,18
Opsanus_beta,240.688157,240.9406473,0.252490278,8/6/2018,2018-08-06T003000_0004e9e500057018_2.0.wav,19
Opsanus_beta,243.3284839,243.5665462,0.238062262,8/6/2018,2018-08-06T003000_0004e9e500057018_2.0.wav,20
Opsanus_beta,245.7163205,245.9471687,0.230848254,8/6/2018,2018-08-06T003000_0004e9e500057018_2.0.wav,21
Opsanus_beta,247.5991765,247.8949508,0.295774325,8/6/2018,2018-08-06T003000_0004e9e500057018_2.0.wav,22
Cynoscion_nebulosus,249.922087,250.1385073,0.216420237,8/6/2018,2018-08-06T003000_0004e9e500057018_2.0.wav,23
Opsanus_beta,250.3982116,250.6362738,0.238062261,8/6/2018,2018-08-06T003000_0004e9e500057018_2.0.wav,24
Opsanus_beta,252.8149042,253.0962505,0.281346309,8/6/2018,2018-08-06T003000_0004e9e500057018_2.0.wav,25
Opsanus_beta,258.4201883,258.6654646,0.24527627,8/6/2018,2018-08-06T003000_0004e9e500057018_2.0.wav,26
Opsanus_beta,255.3037369,255.6139392,0.310202341,8/6/2018,2018-08-06T003000_0004e9e500057018_2.0.wav,27
Opsanus_beta,263.1309354,263.3257136,0.194778214,8/6/2018,2018-08-06T003000_0004e9e500057018_2.0.wav,28
Opsanus_beta,274.1683673,274.4857836,0.317416348,8/6/2018,2018-08-06T003000_0004e9e500057018_2.0.wav,29
Opsanus_beta,275.769877,276.0872934,0.317416348,8/6/2018,2018-08-06T003000_0004e9e500057018_2.0.wav,30
Opsanus_beta,281.6925775,282.0316359,0.339058373,8/6/2018,2018-08-06T003000_0004e9e500057018_2.0.wav,31
Opsanus_beta,296.97906,297.1305541,0.151494167,8/6/2018,2018-08-06T003000_0004e9e500057018_2.0.wav,32
Cynoscion_nebulosus,17.35730358,17.48726675,0.129963173,8/6/2018,2018-08-06T004500_0004e9e500057018_2.0.wav,1
Unknown,32.03592163,32.30306816,0.267146522,8/6/2018,2018-08-06T004500_0004e9e500057018_2.0.wav,2
Cynoscion_nebulosus,44.25245963,44.45462457,0.202164935,8/6/2018,2018-08-06T004500_0004e9e500057018_2.0.wav,3
Opsanus_beta,47.09720904,47.2632731,0.166064054,8/6/2018,2018-08-06T004500_0004e9e500057018_2.0.wav,4
Opsanus_beta,48.7217487,48.97445487,0.252706169,8/6/2018,2018-08-06T004500_0004e9e500057018_2.0.wav,5
Cynoscion_nebulosus,48.12247407,48.20911619,0.086642115,8/6/2018,2018-08-06T004500_0004e9e500057018_2.0.wav,6
Cynoscion_nebulosus,51.49429635,51.65314023,0.158843878,8/6/2018,2018-08-06T004500_0004e9e500057018_2.0.wav,7
Opsanus_beta,136.9017604,137.1183657,0.216605288,8/6/2018,2018-08-06T004500_0004e9e500057018_2.0.wav,8
Cynoscion_nebulosus,135.6382296,135.7681928,0.129963173,8/6/2018,2018-08-06T004500_0004e9e500057018_2.0.wav,9
Cynoscion_nebulosus,133.1039477,133.2844521,0.180504406,8/6/2018,2018-08-06T004500_0004e9e500057018_2.0.wav,10
Opsanus_beta,145.6309534,145.8475587,0.216605288,8/6/2018,2018-08-06T004500_0004e9e500057018_2.0.wav,11
Cynoscion_nebulosus,147.0605483,147.2193922,0.158843877,8/6/2018,2018-08-06T004500_0004e9e500057018_2.0.wav,12
Opsanus_beta,166.2012353,166.475602,0.274366698,8/6/2018,2018-08-06T004500_0004e9e500057018_2.0.wav,13
Opsanus_beta,174.511658,174.6705019,0.158843878,8/6/2018,2018-08-06T004500_0004e9e500057018_2.0.wav,14
Opsanus_beta,183.3383233,183.5982497,0.259926346,8/6/2018,2018-08-06T004500_0004e9e500057018_2.0.wav,15
Opsanus_beta,199.8941873,200.1324532,0.238265816,8/6/2018,2018-08-06T004500_0004e9e500057018_2.0.wav,16
Opsanus_beta,203.7208808,203.9591466,0.238265817,8/6/2018,2018-08-06T004500_0004e9e500057018_2.0.wav,17
Cynoscion_nebulosus,256.4065063,256.514809,0.108302644,8/6/2018,2018-08-06T004500_0004e9e500057018_2.0.wav,18
Opsanus_beta,260.3342821,260.6447496,0.310467579,8/6/2018,2018-08-06T004500_0004e9e500057018_2.0.wav,19
Opsanus_beta,266.6808169,266.9335231,0.252706169,8/6/2018,2018-08-06T004500_0004e9e500057018_2.0.wav,20
Cynoscion_nebulosus,267.9226872,268.0526504,0.129963173,8/6/2018,2018-08-06T004500_0004e9e500057018_2.0.wav,21
Opsanus_beta,275.4244502,275.6410554,0.216605287,8/6/2018,2018-08-06T004500_0004e9e500057018_2.0.wav,22
Cynoscion_nebulosus,276.7674029,277.2583749,0.490971986,8/6/2018,2018-08-06T004500_0004e9e500057018_2.0.wav,23
Opsanus_beta,290.4568569,290.6806824,0.223825464,8/6/2018,2018-08-06T004500_0004e9e500057018_2.0.wav,24
Opsanus_beta,293.8214591,294.0741652,0.252706169,8/6/2018,2018-08-06T004500_0004e9e500057018_2.0.wav,25
Opsanus_beta,292.3918642,292.5723686,0.180504407,8/6/2018,2018-08-06T004500_0004e9e500057018_2.0.wav,26
Opsanus_beta,9.237776661,10.01843384,0.780657183,8/6/2018,2018-08-06T010000_0004e9e500057018_2.0.wav,1
Opsanus_beta,13.18443236,13.87834985,0.693917496,8/6/2018,2018-08-06T010000_0004e9e500057018_2.0.wav,2
Opsanus_beta,34.08869672,34.55130839,0.462611664,8/6/2018,2018-08-06T010000_0004e9e500057018_2.0.wav,3
Opsanus_beta,47.64900085,48.05378605,0.404785206,8/6/2018,2018-08-06T010000_0004e9e500057018_2.0.wav,4
Cynoscion_nebulosus,68.56772177,68.6978313,0.13010953,8/6/2018,2018-08-06T010000_0004e9e500057018_2.0.wav,5
Unknown,70.04229645,70.34588535,0.303588904,8/6/2018,2018-08-06T010000_0004e9e500057018_2.0.wav,6
Cynoscion_nebulosus,71.53132774,71.77709019,0.245762446,8/6/2018,2018-08-06T010000_0004e9e500057018_2.0.wav,7
Opsanus_beta,93.18733606,93.89571017,0.70837411,8/6/2018,2018-08-06T010000_0004e9e500057018_2.0.wav,8
Opsanus_beta,106.5307911,106.9211197,0.390328591,8/6/2018,2018-08-06T010000_0004e9e500057018_2.0.wav,9
Opsanus_beta,109.9280955,110.3473373,0.41924182,8/6/2018,2018-08-06T010000_0004e9e500057018_2.0.wav,10
Opsanus_beta,111.7351723,112.1110442,0.375871976,8/6/2018,2018-08-06T010000_0004e9e500057018_2.0.wav,11
Opsanus_beta,113.8892078,114.293993,0.404785206,8/6/2018,2018-08-06T010000_0004e9e500057018_2.0.wav,12
Opsanus_beta,117.0262932,117.3009688,0.274675675,8/6/2018,2018-08-06T010000_0004e9e500057018_2.0.wav,13
Opsanus_beta,120.7850129,121.0886018,0.303588904,8/6/2018,2018-08-06T010000_0004e9e500057018_2.0.wav,14
Opsanus_beta,124.7461252,125.0063442,0.260219061,8/6/2018,2018-08-06T010000_0004e9e500057018_2.0.wav,16
Opsanus_beta,126.8134211,127.0591835,0.245762447,8/6/2018,2018-08-06T010000_0004e9e500057018_2.0.wav,17
Opsanus_beta,139.9255703,140.4170952,0.491524893,8/6/2018,2018-08-06T010000_0004e9e500057018_2.0.wav,18
Opsanus_beta,147.2117039,147.4430098,0.231305832,8/6/2018,2018-08-06T010000_0004e9e500057018_2.0.wav,19
Cynoscion_nebulosus,152.3148888,153.3413084,1.026419629,8/6/2018,2018-08-06T010000_0004e9e500057018_2.0.wav,20
Opsanus_beta,164.4006184,164.6463808,0.245762446,8/6/2018,2018-08-06T010000_0004e9e500057018_2.0.wav,21
Cynoscion_nebulosus,165.5860606,165.8896495,0.303588904,8/6/2018,2018-08-06T010000_0004e9e500057018_2.0.wav,22
Opsanus_beta,168.1448813,168.3761872,0.231305832,8/6/2018,2018-08-06T010000_0004e9e500057018_2.0.wav,23
Cynoscion_nebulosus,169.8218486,170.183264,0.361415363,8/6/2018,2018-08-06T010000_0004e9e500057018_2.0.wav,24
Opsanus_beta,174.0287234,174.5925313,0.563807965,8/6/2018,2018-08-06T010000_0004e9e500057018_2.0.wav,25
Cynoscion_nebulosus,175.6044943,176.0237361,0.41924182,8/6/2018,2018-08-06T010000_0004e9e500057018_2.0.wav,26
Opsanus_beta,177.1802653,177.3682013,0.187935988,8/6/2018,2018-08-06T010000_0004e9e500057018_2.0.wav,27
Cynoscion_nebulosus,181.3726835,181.7485554,0.375871977,8/6/2018,2018-08-06T010000_0004e9e500057018_2.0.wav,28
Opsanus_beta,182.8183449,183.1797603,0.361415362,8/6/2018,2018-08-06T010000_0004e9e500057018_2.0.wav,29
Cynoscion_nebulosus,186.0566266,186.3891287,0.332502134,8/6/2018,2018-08-06T010000_0004e9e500057018_2.0.wav,30
Opsanus_beta,187.7335938,188.0516393,0.318045519,8/6/2018,2018-08-06T010000_0004e9e500057018_2.0.wav,31
Cynoscion_nebulosus,192.5476464,193.2993904,0.751743954,8/6/2018,2018-08-06T010000_0004e9e500057018_2.0.wav,32
Cynoscion_nebulosus,199.082036,199.4145382,0.332502134,8/6/2018,2018-08-06T010000_0004e9e500057018_2.0.wav,33
Unknown,202.1034685,202.2914045,0.187935988,8/6/2018,2018-08-06T010000_0004e9e500057018_2.0.wav,34
Opsanus_beta,213.8277827,214.1891981,0.361415362,8/6/2018,2018-08-06T010000_0004e9e500057018_2.0.wav,35
Opsanus_beta,243.2614496,243.5939517,0.332502133,8/6/2018,2018-08-06T010000_0004e9e500057018_2.0.wav,37
Opsanus_beta,246.4852746,246.9767995,0.491524893,8/6/2018,2018-08-06T010000_0004e9e500057018_2.0.wav,38
Opsanus_beta,296.9099451,297.5604928,0.650547652,8/6/2018,2018-08-06T010000_0004e9e500057018_2.0.wav,39
Opsanus_beta,1.18542697,1.522660504,0.337233534,8/6/2018,2018-08-06T011500_0004e9e500057018_2.0.wav,1
Opsanus_beta,49.76749399,50.07406993,0.30657594,8/6/2018,2018-08-06T011500_0004e9e500057018_2.0.wav,2
Opsanus_beta,78.39146737,78.7287009,0.337233534,8/6/2018,2018-08-06T011500_0004e9e500057018_2.0.wav,3
Opsanus_beta,112.1659165,112.5235885,0.357671931,8/6/2018,2018-08-06T011500_0004e9e500057018_2.0.wav,4
Opsanus_beta,128.0874269,128.4144413,0.327014337,8/6/2018,2018-08-06T011500_0004e9e500057018_2.0.wav,5
Opsanus_beta,132.6247508,132.9722035,0.347452732,8/6/2018,2018-08-06T011500_0004e9e500057018_2.0.wav,6
Opsanus_beta,163.7524277,164.1100996,0.35767193,8/6/2018,2018-08-06T011500_0004e9e500057018_2.0.wav,7
Cynoscion_nebulosus,181.7790929,181.9323808,0.15328797,8/6/2018,2018-08-06T011500_0004e9e500057018_2.0.wav,8
Unknown,209.8818872,210.2804359,0.398548723,8/6/2018,2018-08-06T011500_0004e9e500057018_2.0.wav,9
Opsanus_beta,233.5904264,233.8970023,0.30657594,8/6/2018,2018-08-06T011500_0004e9e500057018_2.0.wav,10
Opsanus_beta,289.0908903,289.4281239,0.337233535,8/6/2018,2018-08-06T011500_0004e9e500057018_2.0.wav,11
Cynoscion_nebulosus,1.266418451,2.001758197,0.735339746,8/6/2018,2018-08-06T013000_0004e9e500057018_2.0.wav,1
Cynoscion_nebulosus,43.57584804,44.22580269,0.649954651,8/6/2018,2018-08-06T013000_0004e9e500057018_2.0.wav,2
Cynoscion_nebulosus,77.96567046,81.43931698,3.473646523,8/6/2018,2018-08-06T013000_0004e9e500057018_2.0.wav,3
Opsanus_beta,162.2142358,162.5897651,0.375529353,8/6/2018,2018-08-06T013000_0004e9e500057018_2.0.wav,4
Bairdiella_chrysoura,173.4118621,179.026396,5.614533904,8/6/2018,2018-08-06T013000_0004e9e500057018_2.0.wav,5
Opsanus_beta,191.9861215,192.5855241,0.599402623,8/6/2018,2018-08-06T013000_0004e9e500057018_2.0.wav,6
Cynoscion_nebulosus,55.38104963,55.47487912,0.093829487,8/6/2018,2018-08-06T014500_0004e9e500057018_2.0.wav,1
Cynoscion_nebulosus,158.0088543,158.2614722,0.252617849,8/6/2018,2018-08-06T014500_0004e9e500057018_2.0.wav,2
Cynoscion_nebulosus,171.9244889,172.711213,0.786724161,8/6/2018,2018-08-06T014500_0004e9e500057018_2.0.wav,3
Opsanus_beta,204.1296555,204.4761029,0.346447337,8/6/2018,2018-08-06T014500_0004e9e500057018_2.0.wav,4
Cynoscion_nebulosus,251.0949222,251.2464929,0.15157071,8/6/2018,2018-08-06T014500_0004e9e500057018_2.0.wav,5
Opsanus_beta,9.355574548,9.608427916,0.252853368,8/6/2018,2018-08-06T020000_0004e9e500057018_2.0.wav,1
Opsanus_beta,31.57777317,31.8450753,0.267302132,8/6/2018,2018-08-06T020000_0004e9e500057018_2.0.wav,2
Opsanus_beta,46.89346257,47.14631594,0.252853368,8/6/2018,2018-08-06T020000_0004e9e500057018_2.0.wav,3
Cynoscion_nebulosus,77.19974452,77.4453735,0.245628986,8/6/2018,2018-08-06T020000_0004e9e500057018_2.0.wav,4
Opsanus_beta,79.19367393,79.46097607,0.267302132,8/6/2018,2018-08-06T020000_0004e9e500057018_2.0.wav,5
Opsanus_beta,89.90743222,90.18195873,0.274526514,8/6/2018,2018-08-06T020000_0004e9e500057018_2.0.wav,6
Opsanus_beta,138.8887412,139.6111794,0.722438194,8/6/2018,2018-08-06T020000_0004e9e500057018_2.0.wav,7
Opsanus_beta,242.1540556,243.1871422,1.033086618,8/6/2018,2018-08-06T020000_0004e9e500057018_2.0.wav,8
Opsanus_beta,292.1540021,292.984806,0.830803923,8/6/2018,2018-08-06T020000_0004e9e500057018_2.0.wav,10
Opsanus_beta,80.39136142,81.12823408,0.736872659,8/6/2018,2018-08-06T021500_0004e9e500057018_2.0.wav,1
Opsanus_beta,115.1977578,116.1658062,0.968048395,8/6/2018,2018-08-06T021500_0004e9e500057018_2.0.wav,2
Opsanus_beta,133.5328832,133.8435256,0.310642395,8/6/2018,2018-08-06T021500_0004e9e500057018_2.0.wav,3
Unknown,207.3501846,207.5018936,0.151709077,8/6/2018,2018-08-06T021500_0004e9e500057018_2.0.wav,4
Unknown,208.8383784,208.946742,0.108363626,8/6/2018,2018-08-06T021500_0004e9e500057018_2.0.wav,5
Opsanus_beta,238.2988359,238.6383753,0.339539362,8/6/2018,2018-08-06T021500_0004e9e500057018_2.0.wav,6
Opsanus_beta,63.10827414,63.93161396,0.823339817,8/6/2018,2018-08-06T023000_0004e9e500057018_2.0.wav,1
Opsanus_beta,143.3766833,143.7594641,0.382780793,8/6/2018,2018-08-06T023000_0004e9e500057018_2.0.wav,3
Opsanus_beta,171.8974631,172.1863542,0.288891164,8/6/2018,2018-08-06T023000_0004e9e500057018_2.0.wav,4
Opsanus_beta,228.8956892,230.4990351,1.60334596,8/6/2018,2018-08-06T023000_0004e9e500057018_2.0.wav,5
Opsanus_beta,275.5732783,276.5771751,1.003896795,8/6/2018,2018-08-06T023000_0004e9e500057018_2.0.wav,6
Opsanus_beta,297.0956693,298.0056765,0.910007167,8/6/2018,2018-08-06T023000_0004e9e500057018_2.0.wav,7
Cynoscion_nebulosus,1.962009888,2.094854308,0.13284442,8/6/2018,2018-08-06T024500_0004e9e500057018_2.0.wav,1
Unknown,17.51502566,17.84202731,0.327001648,8/6/2018,2018-08-06T024500_0004e9e500057018_2.0.wav,2
Cynoscion_nebulosus,25.40394034,29.2155533,3.81161296,8/6/2018,2018-08-06T024500_0004e9e500057018_2.0.wav,3
Cynoscion_nebulosus,31.07537517,31.58631525,0.510940075,8/6/2018,2018-08-06T024500_0004e9e500057018_2.0.wav,4
Opsanus_beta,97.52824075,98.46837049,0.940129738,8/6/2018,2018-08-06T024500_0004e9e500057018_2.0.wav,5
Cynoscion_nebulosus,105.437593,106.5514424,1.113849363,8/6/2018,2018-08-06T024500_0004e9e500057018_2.0.wav,6
Opsanus_beta,149.0105623,149.490846,0.480283671,8/6/2018,2018-08-06T024500_0004e9e500057018_2.0.wav,7
Opsanus_beta,186.9938471,187.4639119,0.470064869,8/6/2018,2018-08-06T024500_0004e9e500057018_2.0.wav,8
Opsanus_beta,205.8986297,206.3176005,0.41897086100000003,8/6/2018,2018-08-06T024500_0004e9e500057018_2.0.wav,9
Cynoscion_nebulosus,24.11284911,24.32227488,0.209425767,8/6/2018,2018-08-06T030000_0004e9e500057018_2.0.wav,1
Opsanus_beta,29.32682847,29.70235053,0.375522064,8/6/2018,2018-08-06T030000_0004e9e500057018_2.0.wav,2
Cynoscion_nebulosus,175.2893645,175.4410176,0.151653141,8/6/2018,2018-08-06T030000_0004e9e500057018_2.0.wav,3
Cynoscion_nebulosus,214.8997201,215.0947027,0.19498261,8/6/2018,2018-08-06T030000_0004e9e500057018_2.0.wav,4
Cynoscion_nebulosus,217.5139314,218.1133224,0.599390987,8/6/2018,2018-08-06T030000_0004e9e500057018_2.0.wav,5
Opsanus_beta,114.2607068,114.3274953,0.066788463,8/6/2018,2018-08-06T034500_0004e9e500057018_2.0.wav,1
Cynoscion_nebulosus,117.636864,118.3610048,0.724140815,8/6/2018,2018-08-06T034500_0004e9e500057018_2.0.wav,2
Opsanus_beta,142.7850156,143.0132774,0.228261779,8/6/2018,2018-08-06T034500_0004e9e500057018_2.0.wav,3
Unknown,70.2453928,70.36780743,0.122414633,8/6/2018,2018-08-06T040000_0004e9e500057018_2.0.wav,1
Cynoscion_nebulosus,74.73578411,74.85819874,0.122414633,8/6/2018,2018-08-06T040000_0004e9e500057018_2.0.wav,2
Cynoscion_nebulosus,282.551316,282.7126807,0.161364743,8/6/2018,2018-08-06T040000_0004e9e500057018_2.0.wav,3
Cynoscion_nebulosus,128.1416519,128.2595809,0.117929002,8/6/2018,2018-08-06T041500_0004e9e500057018_2.0.wav,1
Cynoscion_nebulosus,19.66188687,19.76916139,0.107274517,8/6/2018,2018-08-06T050000_0004e9e500057018_2.0.wav,1
Cynoscion_nebulosus,79.01023715,79.12261998,0.112382827,8/6/2018,2018-08-06T050000_0004e9e500057018_2.0.wav,2
Cynoscion_nebulosus,88.52191119,88.6240774,0.102166206,8/6/2018,2018-08-06T050000_0004e9e500057018_2.0.wav,3
Cynoscion_nebulosus,199.4386553,199.5152799,0.076624655,8/6/2018,2018-08-06T050000_0004e9e500057018_2.0.wav,4
Unknown,281.4321454,281.7897271,0.357581724,8/6/2018,2018-08-06T050000_0004e9e500057018_2.0.wav,5
Unknown,282.6836814,282.8522556,0.168574241,8/6/2018,2018-08-06T050000_0004e9e500057018_2.0.wav,6
Opsanus_beta,15.20049166,16.14634949,0.945857827,8/6/2018,2018-08-06T051500_0004e9e500057018_2.0.wav,1
Cynoscion_nebulosus,31.05751993,31.26894697,0.211427044,8/6/2018,2018-08-06T051500_0004e9e500057018_2.0.wav,2
Cynoscion_nebulosus,32.62653115,32.84908593,0.222554783,8/6/2018,2018-08-06T051500_0004e9e500057018_2.0.wav,3
Opsanus_beta,266.8098013,267.7334036,0.923602348,8/6/2018,2018-08-06T051500_0004e9e500057018_2.0.wav,4
Cynoscion_nebulosus,272.6629921,273.1414848,0.478492783,8/6/2018,2018-08-06T051500_0004e9e500057018_2.0.wav,5
Opsanus_beta,0.531056396,0.688963985,0.157907589,8/6/2018,2018-08-06T053000_0004e9e500057018_2.0.wav,1
Unknown,1.243896366,1.938689753,0.694793387,8/6/2018,2018-08-06T053000_0004e9e500057018_2.0.wav,2
Unknown,5.966304062,6.150181822,0.18387776,8/6/2018,2018-08-06T060000_0004e9e500057018_2.0.wav,1
Cynoscion_nebulosus,77.47432126,77.69906075,0.224739484,8/6/2018,2018-08-06T060000_0004e9e500057018_2.0.wav,2
Cynoscion_nebulosus,11.18958757,21.98064181,10.79105425,8/6/2018,2018-08-06T061500_0004e9e500057018_2.0.wav,1
Opsanus_beta,83.19126183,84.11095397,0.919692135,8/6/2018,2018-08-06T061500_0004e9e500057018_2.0.wav,2
Cynoscion_nebulosus,225.8968236,233.5302683,7.633444721,8/6/2018,2018-08-06T061500_0004e9e500057018_2.0.wav,3
Cynoscion_nebulosus,235.8908114,236.064531,0.173719626,8/6/2018,2018-08-06T061500_0004e9e500057018_2.0.wav,4
Opsanus_beta,43.05884375,43.88162422,0.822780461,8/6/2018,2018-08-06T063000_0004e9e500057018_2.0.wav,1
Opsanus_beta,73.21302551,73.566676760000007,0.353651251,8/6/2018,2018-08-06T063000_0004e9e500057018_2.0.wav,2
Opsanus_beta,181.682915,182.5634344,0.880519441,8/6/2018,2018-08-06T063000_0004e9e500057018_2.0.wav,3
Cynoscion_nebulosus,200.9677339,201.9853835,1.017649518,8/6/2018,2018-08-06T063000_0004e9e500057018_2.0.wav,4
Cynoscion_nebulosus,230.9559162,231.1074811,0.151564822,8/6/2018,2018-08-06T063000_0004e9e500057018_2.0.wav,5
Cynoscion_nebulosus,53.48520663,60.18874042,6.703533784,8/6/2018,2018-08-06T064500_0004e9e500057018_2.0.wav,1
Cynoscion_nebulosus,61.27193334,61.50696577,0.235032434,8/6/2018,2018-08-06T064500_0004e9e500057018_2.0.wav,2
Cynoscion_nebulosus,63.33613124,63.48941326,0.153282023,8/6/2018,2018-08-06T064500_0004e9e500057018_2.0.wav,3
Cynoscion_nebulosus,65.15507787,65.26748468,0.112406816,8/6/2018,2018-08-06T064500_0004e9e500057018_2.0.wav,4
Cynoscion_nebulosus,75.95635094,79.40008704,3.443736106,8/6/2018,2018-08-06T064500_0004e9e500057018_2.0.wav,5
Cynoscion_nebulosus,85.26567907,86.03208918,0.766410113,8/6/2018,2018-08-06T064500_0004e9e500057018_2.0.wav,6
Cynoscion_nebulosus,89.86413967,90.0991721,0.235032435,8/6/2018,2018-08-06T064500_0004e9e500057018_2.0.wav,7
Cynoscion_nebulosus,262.2553196,262.4801332,0.224813633,8/6/2018,2018-08-06T064500_0004e9e500057018_2.0.wav,8
Opsanus_beta,115.4753284,116.4409864,0.965658007,8/6/2018,2018-08-06T070000_0004e9e500057018_2.0.wav,1
Cynoscion_nebulosus,143.7042201,145.1756989,1.471478867,8/6/2018,2018-08-06T070000_0004e9e500057018_2.0.wav,2
Opsanus_beta,178.774467,179.5919553,0.81748826,8/6/2018,2018-08-06T070000_0004e9e500057018_2.0.wav,3
Cynoscion_nebulosus,228.4368794,231.4002743,2.96339494,8/6/2018,2018-08-06T070000_0004e9e500057018_2.0.wav,4
Cynoscion_nebulosus,232.6571626,232.74913,0.091967429,8/6/2018,2018-08-06T070000_0004e9e500057018_2.0.wav,5
Cynoscion_nebulosus,234.1388598,234.2410459,0.102186032,8/6/2018,2018-08-06T070000_0004e9e500057018_2.0.wav,6
Cynoscion_nebulosus,236.4176084,236.5146851,0.09707673,8/6/2018,2018-08-06T070000_0004e9e500057018_2.0.wav,7
Cynoscion_nebulosus,245.0318908,247.9288649,2.896974019,8/6/2018,2018-08-06T070000_0004e9e500057018_2.0.wav,8
Opsanus_beta,137.8719764,138.6016106,0.729634258,8/6/2018,2018-08-06T071500_0004e9e500057018_2.0.wav,1
Unknown,149.0404373,149.1487988,0.108361523,8/6/2018,2018-08-06T071500_0004e9e500057018_2.0.wav,2
Opsanus_beta,162.76623,163.5681052,0.801875274,8/6/2018,2018-08-06T071500_0004e9e500057018_2.0.wav,3
Opsanus_beta,195.5636508,196.4016465,0.837995781,8/6/2018,2018-08-06T071500_0004e9e500057018_2.0.wav,4
Opsanus_beta,220.0822512,221.0430567,0.960805508,8/6/2018,2018-08-06T071500_0004e9e500057018_2.0.wav,5
Cynoscion_nebulosus,285.8576947,286.8618448,1.004150118,8/6/2018,2018-08-06T071500_0004e9e500057018_2.0.wav,6
Opsanus_beta,62.20309615,63.11317397,0.910077822,8/6/2018,2018-08-06T073000_0004e9e500057018_2.0.wav,1
Opsanus_beta,284.8254638,285.851107,1.02564326,8/6/2018,2018-08-06T073000_0004e9e500057018_2.0.wav,2
Cynoscion_nebulosus,265.9593822,266.7958607,0.83647858,8/6/2018,2018-08-06T074500_0004e9e500057018_2.0.wav,1
Cynoscion_nebulosus,73.04275261,73.20169826,0.158945655,8/6/2018,2018-08-06T080000_0004e9e500057018_2.0.wav,1
Opsanus_beta,146.3889468,147.1981247,0.809177881,8/6/2018,2018-08-06T080000_0004e9e500057018_2.0.wav,2
Cynoscion_nebulosus,277.0278243,277.2156692,0.187844865,8/6/2018,2018-08-06T080000_0004e9e500057018_2.0.wav,3
Cynoscion_nebulosus,293.9772108,295.5522178,1.575006947,8/6/2018,2018-08-06T080000_0004e9e500057018_2.0.wav,4
Cynoscion_nebulosus,298.0519994,298.4854876,0.433488151,8/6/2018,2018-08-06T080000_0004e9e500057018_2.0.wav,5
Opsanus_beta,39.60790403,40.66999121,1.062087184,8/6/2018,2018-08-06T081500_0004e9e500057018_2.0.wav,1
Cynoscion_nebulosus,53.42948741,53.88466763,0.455180222,8/6/2018,2018-08-06T081500_0004e9e500057018_2.0.wav,2
Cynoscion_nebulosus,93.55759727,93.65152334,0.093926078,8/6/2018,2018-08-06T081500_0004e9e500057018_2.0.wav,3
Opsanus_beta,122.761382,123.4549899,0.693607957,8/6/2018,2018-08-06T081500_0004e9e500057018_2.0.wav,4
Opsanus_beta,191.9343246,192.7435338,0.809209284,8/6/2018,2018-08-06T081500_0004e9e500057018_2.0.wav,5
Opsanus_beta,16.53548007,17.40272553,0.867245465,8/6/2018,2018-08-06T083000_0004e9e500057018_2.0.wav,1
Opsanus_beta,49.1583633,49.82325149,0.66488819,8/6/2018,2018-08-06T083000_0004e9e500057018_2.0.wav,2
Opsanus_beta,68.86651629,69.71930767,0.852791374,8/6/2018,2018-08-06T083000_0004e9e500057018_2.0.wav,3
Cynoscion_nebulosus,75.62380381,80.50928659,4.885482786,8/6/2018,2018-08-06T083000_0004e9e500057018_2.0.wav,4
Opsanus_beta,110.1184918,110.7255636,0.607071825,8/6/2018,2018-08-06T083000_0004e9e500057018_2.0.wav,5
Unknown,145.5743767,145.9212749,0.346898186,8/6/2018,2018-08-06T083000_0004e9e500057018_2.0.wav,6
Opsanus_beta,158.4529718,158.8865945,0.433622733,8/6/2018,2018-08-06T083000_0004e9e500057018_2.0.wav,7
Opsanus_beta,283.3796796,284.0301137,0.650434099,8/6/2018,2018-08-06T083000_0004e9e500057018_2.0.wav,8
Opsanus_beta,28.30830462,28.94622385,0.637919236,8/6/2018,2018-08-06T084500_0004e9e500057018_2.0.wav,1
Opsanus_beta,147.4869299,148.180986,0.694056129,8/6/2018,2018-08-06T084500_0004e9e500057018_2.0.wav,2
Cynoscion_nebulosus,193.7437304,193.8049706,0.061240247,8/6/2018,2018-08-06T084500_0004e9e500057018_2.0.wav,3
Opsanus_beta,217.8060445,218.7807851,0.974740592,8/6/2018,2018-08-06T084500_0004e9e500057018_2.0.wav,4
Cynoscion_nebulosus,32.21289759,32.37821305,0.16531546,8/6/2018,2018-08-06T090000_0004e9e500057018_2.0.wav,1
Opsanus_beta,75.64363025,76.4151024,0.771472146,8/6/2018,2018-08-06T090000_0004e9e500057018_2.0.wav,2
Unknown,79.84736621,79.95757651,0.110210307,8/6/2018,2018-08-06T090000_0004e9e500057018_2.0.wav,3
Cynoscion_nebulosus,110.233922,110.3834931,0.14957113,8/6/2018,2018-08-06T090000_0004e9e500057018_2.0.wav,4
Opsanus_beta,120.2118906,121.0069793,0.795088641,8/6/2018,2018-08-06T090000_0004e9e500057018_2.0.wav,5
Unknown,150.8031225,151.0235431,0.220420614,8/6/2018,2018-08-06T090000_0004e9e500057018_2.0.wav,6
Cynoscion_nebulosus,151.2911967,151.4171514,0.125954637,8/6/2018,2018-08-06T090000_0004e9e500057018_2.0.wav,7
Cynoscion_nebulosus,200.8937065,201.0039168,0.110210307,8/6/2018,2018-08-06T090000_0004e9e500057018_2.0.wav,8
Opsanus_beta,12.3016404,13.21452231,0.912881909,8/6/2018,2018-08-06T091500_0004e9e500057018_2.0.wav,1
Cynoscion_nebulosus,13.52623808,13.76002491,0.233786831,8/6/2018,2018-08-06T091500_0004e9e500057018_2.0.wav,2
Cynoscion_nebulosus,15.46332896,15.57465602,0.111327062,8/6/2018,2018-08-06T091500_0004e9e500057018_2.0.wav,3
Cynoscion_nebulosus,41.93690412,42.0704966,0.133592475,8/6/2018,2018-08-06T091500_0004e9e500057018_2.0.wav,4
Cynoscion_nebulosus,43.16150181,43.31735969,0.155857887,8/6/2018,2018-08-06T091500_0004e9e500057018_2.0.wav,5
Cynoscion_nebulosus,44.78687691,46.28979225,1.502915338,8/6/2018,2018-08-06T091500_0004e9e500057018_2.0.wav,6
Cynoscion_nebulosus,47.65911511,49.2399594,1.580844282,8/6/2018,2018-08-06T091500_0004e9e500057018_2.0.wav,7
Cynoscion_nebulosus,50.11944305,56.63207618,6.512633131,8/6/2018,2018-08-06T091500_0004e9e500057018_2.0.wav,8
Opsanus_beta,61.33007818,62.20956198,0.879483791,8/6/2018,2018-08-06T091500_0004e9e500057018_2.0.wav,9
Cynoscion_nebulosus,99.11448303,99.17014656,0.055663531,8/6/2018,2018-08-06T091500_0004e9e500057018_2.0.wav,10
Cynoscion_nebulosus,126.0111009,127.4138219,1.402720982,8/6/2018,2018-08-06T091500_0004e9e500057018_2.0.wav,11
Opsanus_beta,140.3388937,141.2183775,0.87948379,8/6/2018,2018-08-06T091500_0004e9e500057018_2.0.wav,12
Opsanus_beta,249.5507414,250.5081541,0.957412734,8/6/2018,2018-08-06T091500_0004e9e500057018_2.0.wav,13
Opsanus_beta,36.52570049,36.77061527,0.244914785,8/6/2018,2018-08-06T093000_0004e9e500057018_2.0.wav,1
Cynoscion_nebulosus,78.99615077,81.21151633,2.215365559,8/6/2018,2018-08-06T093000_0004e9e500057018_2.0.wav,2
Opsanus_beta,106.7605814,107.7402406,0.979659142,8/6/2018,2018-08-06T093000_0004e9e500057018_2.0.wav,3
Cynoscion_nebulosus,156.8790522,159.0721528,2.193100579,8/6/2018,2018-08-06T093000_0004e9e500057018_2.0.wav,4
Cynoscion_nebulosus,199.2159126,204.425918,5.210005436,8/6/2018,2018-08-06T093000_0004e9e500057018_2.0.wav,5
Cynoscion_nebulosus,206.7526085,209.5023336,2.749725091,8/6/2018,2018-08-06T093000_0004e9e500057018_2.0.wav,6
Opsanus_beta,211.6397717,212.3745161,0.734744356,8/6/2018,2018-08-06T093000_0004e9e500057018_2.0.wav,7
Cynoscion_nebulosus,259.2756975,261.1236909,1.847993381,8/6/2018,2018-08-06T093000_0004e9e500057018_2.0.wav,8
Cynoscion_nebulosus,262.2258074,263.1609366,0.935129181,8/6/2018,2018-08-06T093000_0004e9e500057018_2.0.wav,9
Opsanus_beta,9.434814119,9.607374412,0.172560293,8/6/2018,2018-08-06T094500_0004e9e500057018_2.0.wav,1
Opsanus_beta,36.37091928,36.6102771,0.239357826,8/6/2018,2018-08-06T094500_0004e9e500057018_2.0.wav,2
Opsanus_beta,20.59278531,20.75977914,0.166993832,8/6/2018,2018-08-06T094500_0004e9e500057018_2.0.wav,3
Opsanus_beta,24.58950423,24.81772913,0.228224904,8/6/2018,2018-08-06T094500_0004e9e500057018_2.0.wav,4
Opsanus_beta,130.0294097,130.3856632,0.35625351,8/6/2018,2018-08-06T094500_0004e9e500057018_2.0.wav,5
Opsanus_beta,276.5943296,276.8559533,0.261623671,8/6/2018,2018-08-06T094500_0004e9e500057018_2.0.wav,6
Cynoscion_nebulosus,293.6889316,294.2177454,0.528813803,8/6/2018,2018-08-06T094500_0004e9e500057018_2.0.wav,7
Opsanus_beta,2.85738689,3.124224577,0.266837687,8/6/2018,2018-08-06T100000_0004e9e500057018_2.0.wav,1
Opsanus_beta,11.15159163,11.40731108,0.255719449,8/6/2018,2018-08-06T100000_0004e9e500057018_2.0.wav,2
Opsanus_beta,34.95573684,35.26704748,0.311310634,8/6/2018,2018-08-06T100000_0004e9e500057018_2.0.wav,3
Opsanus_beta,71.94611108,72.29077643,0.344665345,8/6/2018,2018-08-06T100000_0004e9e500057018_2.0.wav,4
Opsanus_beta,84.9433299,85.3324682,0.389138293,8/6/2018,2018-08-06T100000_0004e9e500057018_2.0.wav,5
Opsanus_beta,100.6533987,100.9869458,0.333547108,8/6/2018,2018-08-06T100000_0004e9e500057018_2.0.wav,6
Cynoscion_nebulosus,104.188998,104.9450381,0.756040111,8/6/2018,2018-08-06T100000_0004e9e500057018_2.0.wav,7
Opsanus_beta,110.0260724,110.4930384,0.466965951,8/6/2018,2018-08-06T100000_0004e9e500057018_2.0.wav,8
Opsanus_beta,142.7470437,143.7699215,1.022877797,8/6/2018,2018-08-06T100000_0004e9e500057018_2.0.wav,9
Opsanus_beta,160.2805033,160.5362227,0.255719449,8/6/2018,2018-08-06T100000_0004e9e500057018_2.0.wav,10
Opsanus_beta,182.4391493,183.3953177,0.956168375,8/6/2018,2018-08-06T100000_0004e9e500057018_2.0.wav,11
Opsanus_beta,205.8319198,206.310004,0.478084187,8/6/2018,2018-08-06T100000_0004e9e500057018_2.0.wav,12
Opsanus_beta,222.7316399,223.0763053,0.344665345,8/6/2018,2018-08-06T100000_0004e9e500057018_2.0.wav,13
Opsanus_beta,240.8988391,241.2323862,0.333547108,8/6/2018,2018-08-06T100000_0004e9e500057018_2.0.wav,14
Opsanus_beta,256.7423267,257.0425191,0.300192397,8/6/2018,2018-08-06T100000_0004e9e500057018_2.0.wav,15
Opsanus_beta,277.0998185,277.4667203,0.366901819,8/6/2018,2018-08-06T100000_0004e9e500057018_2.0.wav,16
Unknown,47.76084611,52.44058319,4.679737083,12/1/2017,2017-12-01T000000_0004e9e50005718b_2.0.wav,1
Tursiops_truncatus_Echo,62.47296073,80.19784726,17.72488653,12/1/2017,2017-12-01T000000_0004e9e50005718b_2.0.wav,2
Tursiops_truncatus_Echo,140.0556608,155.1654001,15.10973934,12/1/2017,2017-12-01T000000_0004e9e50005718b_2.0.wav,4
Tursiops_truncatus_Echo,170.8562833,181.0263002,10.17001686,12/1/2017,2017-12-01T000000_0004e9e50005718b_2.0.wav,5
Cynoscion_nebulosus,9.659484383,28.70246788,19.0429835,12/1/2017,2017-12-01T000500_0004e9e50005718b_2.0.wav,1
Cynoscion_nebulosus,171.1108662,192.6377171,21.52685091,12/1/2017,2017-12-01T000500_0004e9e50005718b_2.0.wav,2
Tursiops_truncatus_Echo,256.0444566,267.6685608,11.62410416,12/1/2017,2017-12-01T001000_0004e9e50005718b_2.0.wav,1
Tursiops_truncatus_Echo,22.35480671,64.30456746,41.94976075,12/1/2017,2017-12-01T001500_0004e9e50005718b_2.0.wav,1
Opsanus_beta,82.79433712,94.05887278,11.26453566,12/1/2017,2017-12-01T004000_0004e9e50005718b_2.0.wav,1
Opsanus_beta,136.3008815,156.5770457,20.27616419,12/1/2017,2017-12-01T004000_0004e9e50005718b_2.0.wav,2
Opsanus_beta,116.7417684,142.4083983,25.66662993,12/1/2017,2017-12-01T004500_0004e9e50005718b_2.0.wav,1
Opsanus_beta,146.5481773,159.2434997,12.69532233,12/1/2017,2017-12-01T004500_0004e9e50005718b_2.0.wav,2
Unknown,196.7774961,205.88501,9.107513846,12/1/2017,2017-12-01T004500_0004e9e50005718b_2.0.wav,3
Unknown,206.1609953,231.5516399,25.39064466,12/1/2017,2017-12-01T004500_0004e9e50005718b_2.0.wav,4
Opsanus_beta,12.53834732,26.98470402,14.44635669,12/1/2017,2017-12-01T005000_0004e9e50005718b_2.0.wav,1
Ariopsis_felis,207.4661692,229.4254635,21.95929437,12/1/2017,2017-12-01T005000_0004e9e50005718b_2.0.wav,3
Unknown,258.9230231,267.4445404,8.521517218,12/1/2017,2017-12-01T005000_0004e9e50005718b_2.0.wav,4
Unknown,85.00346257,98.25075543,13.24729287,12/1/2017,2017-12-01T010000_0004e9e50005718b_2.0.wav,1
Ariopsis_felis,160.0714555,175.8026158,15.73116028,12/1/2017,2017-12-01T010000_0004e9e50005718b_2.0.wav,2
Ariopsis_felis,268.22509,287.6250179,19.39992789,12/1/2017,2017-12-01T011000_0004e9e50005718b_2.0.wav,1
Tursiops_truncatus_Echo,52.7131862,71.48018443,18.76699823,12/1/2017,2017-12-01T011500_0004e9e50005718b_2.0.wav,1
Tursiops_truncatus_Echo,155.1037207,171.6628367,16.55911608,12/1/2017,2017-12-01T011500_0004e9e50005718b_2.0.wav,4
Tursiops_truncatus_Whistle,86.64369257,105.1276803,18.48398775,12/1/2017,2017-12-01T012000_0004e9e50005718b_2.0.wav,4
Tursiops_truncatus_Echo,179.9300682,202.4574283,22.52736007,12/1/2017,2017-12-01T012000_0004e9e50005718b_2.0.wav,5
Opsanus_beta,221.5190407,244.0464007,22.52736007,12/1/2017,2017-12-01T012000_0004e9e50005718b_2.0.wav,6
Tursiops_truncatus_Echo,257.6543554,275.5607185,17.90636313,12/1/2017,2017-12-01T012000_0004e9e50005718b_2.0.wav,7
Tursiops_truncatus_Whistle,276.3933793,296.3214286,19.92804929,12/1/2017,2017-12-01T012000_0004e9e50005718b_2.0.wav,8
Tursiops_truncatus_Echo,38.08596699,65.13252327,27.04655627,12/1/2017,2017-12-01T012500_0004e9e50005718b_2.0.wav,3
Opsanus_beta,67.89237595,83.07156569,15.17918974,12/1/2017,2017-12-01T012500_0004e9e50005718b_2.0.wav,4
Opsanus_beta,163.9352492,189.6018792,25.66662993,12/1/2017,2017-12-01T013000_0004e9e50005718b_2.0.wav,1
Bairdiella_chrysoura,171.1991745,197.3697489,26.17057445,12/1/2017,2017-12-01T013500_0004e9e50005718b_2.0.wav,1
Ariopsis_felis,80.18584309,99.25100858,19.06516549,12/1/2017,2017-12-01T014000_0004e9e50005718b_2.0.wav,2
Bairdiella_chrysoura,102.3350795,119.9983946,17.66331509,12/1/2017,2017-12-01T014000_0004e9e50005718b_2.0.wav,3
Ariopsis_felis,120.5591347,139.6243002,19.06516549,12/1/2017,2017-12-01T014000_0004e9e50005718b_2.0.wav,4
Tursiops_truncatus_Whistle,199.0627573,217.8475527,18.78479541,12/1/2017,2017-12-01T014000_0004e9e50005718b_2.0.wav,6
Tursiops_truncatus_Whistle,269.7160177,288.5008131,18.78479541,12/1/2017,2017-12-01T014000_0004e9e50005718b_2.0.wav,8
Ariopsis_felis,247.504642,275.1818963,27.67725431,12/1/2017,2017-12-01T014500_0004e9e50005718b_2.0.wav,1
Ariopsis_felis,45.69621623,67.02111713,21.3249009,12/1/2017,2017-12-01T015000_0004e9e50005718b_2.0.wav,1
Tursiops_truncatus_Echo,110.2248125,135.4269681,25.20215561,12/1/2017,2017-12-01T015000_0004e9e50005718b_2.0.wav,3
Tursiops_truncatus_Echo,146.5048387,166.9988993,20.49406061,12/1/2017,2017-12-01T015000_0004e9e50005718b_2.0.wav,4
Tursiops_truncatus_Echo,212.4181688,232.6352826,20.21711385,12/1/2017,2017-12-01T015000_0004e9e50005718b_2.0.wav,6
Tursiops_truncatus_Echo,242.6053661,265.3150009,22.70963473,12/1/2017,2017-12-01T015000_0004e9e50005718b_2.0.wav,7
Tursiops_truncatus_Echo,286.0860082,296.3330385,10.2470303,12/1/2017,2017-12-01T015000_0004e9e50005718b_2.0.wav,9
Tursiops_truncatus_Echo,0.280632354,19.92489713,19.64426478,12/1/2017,2017-12-01T015500_0004e9e50005718b_2.0.wav,1
Tursiops_truncatus_Echo,22.45058832,42.93675016,20.48616184,12/1/2017,2017-12-01T015500_0004e9e50005718b_2.0.wav,2
Tursiops_truncatus_Echo,157.7153829,178.4821771,20.76679419,12/1/2017,2017-12-01T015500_0004e9e50005718b_2.0.wav,7
Tursiops_truncatus_Whistle,191.6718978,211.5967949,19.92489713,12/1/2017,2017-12-01T015500_0004e9e50005718b_2.0.wav,8
Bairdiella_chrysoura,220.5770302,239.3793979,18.80236772,12/1/2017,2017-12-01T015500_0004e9e50005718b_2.0.wav,9
Bairdiella_chrysoura,248.920898,267.7232657,18.80236772,12/1/2017,2017-12-01T015500_0004e9e50005718b_2.0.wav,10
Bairdiella_chrysoura,0.833704813,18.61940749,17.78570267,12/1/2017,2017-12-01T020000_0004e9e50005718b_2.0.wav,1
Bairdiella_chrysoura,29.73547166,50.02228877,20.28681711,12/1/2017,2017-12-01T020000_0004e9e50005718b_2.0.wav,2
Bairdiella_chrysoura,103.6572984,129.224246,25.56694759,12/1/2017,2017-12-01T020000_0004e9e50005718b_2.0.wav,5
Bairdiella_chrysoura,150.3447679,175.3559123,25.01114438,12/1/2017,2017-12-01T020000_0004e9e50005718b_2.0.wav,6
Tursiops_truncatus_Echo,208.1483016,230.1025283,21.95422674,12/1/2017,2017-12-01T020000_0004e9e50005718b_2.0.wav,8
Bairdiella_chrysoura,277.0678994,297.3547166,20.28681711,12/1/2017,2017-12-01T020000_0004e9e50005718b_2.0.wav,9
Bairdiella_chrysoura,5.527410143,24.59697514,19.06956499,12/1/2017,2017-12-01T020500_0004e9e50005718b_2.0.wav,1
Bairdiella_chrysoura,29.57164427,48.64120926,19.06956499,12/1/2017,2017-12-01T020500_0004e9e50005718b_2.0.wav,2
Unknown,82.63478164,105.8499042,23.2151226,12/1/2017,2017-12-01T020500_0004e9e50005718b_2.0.wav,3
Unknown,134.3160665,154.214743,19.89867652,12/1/2017,2017-12-01T020500_0004e9e50005718b_2.0.wav,4
Bairdiella_chrysoura,187.3792039,207.2778804,19.89867652,12/1/2017,2017-12-01T020500_0004e9e50005718b_2.0.wav,5
Bairdiella_chrysoura,268.0793919,289.0835505,21.00415854,12/1/2017,2017-12-01T020500_0004e9e50005718b_2.0.wav,6
Bairdiella_chrysoura,132.3016007,153.0878395,20.78623876,12/1/2017,2017-12-01T021000_0004e9e50005718b_2.0.wav,3
Bairdiella_chrysoura,102.8891313,123.4107339,20.52160268,12/1/2017,2017-12-01T021500_0004e9e50005718b_2.0.wav,1
Ariopsis_felis,168.3895891,190.0356632,21.64607406,12/1/2017,2017-12-01T021500_0004e9e50005718b_2.0.wav,2
Bairdiella_chrysoura,209.1516767,230.235515,21.08383837,12/1/2017,2017-12-01T021500_0004e9e50005718b_2.0.wav,3
Bairdiella_chrysoura,236.1389898,256.9417103,20.80272053,12/1/2017,2017-12-01T021500_0004e9e50005718b_2.0.wav,4
Bairdiella_chrysoura,61.40104768,82.42880374,21.02775605,12/1/2017,2017-12-01T022000_0004e9e50005718b_2.0.wav,1
Bairdiella_chrysoura,168.5024185,190.0909147,21.58849622,12/1/2017,2017-12-01T022000_0004e9e50005718b_2.0.wav,2
Bairdiella_chrysoura,217.2868126,238.8753088,21.58849622,12/1/2017,2017-12-01T022000_0004e9e50005718b_2.0.wav,3
Ariopsis_felis,285.6971123,299.9959864,14.29887412,12/1/2017,2017-12-01T022000_0004e9e50005718b_2.0.wav,4
Bairdiella_chrysoura,141.8672609,162.3342768,20.46701589,12/1/2017,2017-12-01T022500_0004e9e50005718b_2.0.wav,1
Bairdiella_chrysoura,58.5359077,78.88410418,20.34819648,12/1/2017,2017-12-01T023000_0004e9e50005718b_2.0.wav,1
Bairdiella_chrysoura,164.179284,188.7086167,24.52933275,12/1/2017,2017-12-01T023000_0004e9e50005718b_2.0.wav,2
Unknown,239.7184791,258.3942211,18.67574198,12/1/2017,2017-12-01T023000_0004e9e50005718b_2.0.wav,3
Bairdiella_chrysoura,1.675955231,20.11146278,18.43550754,12/1/2017,2017-12-01T023500_0004e9e50005718b_2.0.wav,1
Bairdiella_chrysoura,77.93191825,97.76405516,19.8321369,12/1/2017,2017-12-01T023500_0004e9e50005718b_2.0.wav,2
Bairdiella_chrysoura,274.8566579,294.6887948,19.8321369,12/1/2017,2017-12-01T023500_0004e9e50005718b_2.0.wav,3
Tursiops_truncatus_Echo,162.6857934,188.0613937,25.37560035,12/1/2017,2017-12-01T024000_0004e9e50005718b_2.0.wav,2
Tursiops_truncatus_Echo,252.346248,275.7481905,23.40194255,12/1/2017,2017-12-01T024000_0004e9e50005718b_2.0.wav,3
Tursiops_truncatus_Echo,279.6955061,299.9959864,20.30048028,12/1/2017,2017-12-01T024000_0004e9e50005718b_2.0.wav,4
Tursiops_truncatus_Echo,1.110901738,19.44078041,18.32987867,12/1/2017,2017-12-01T024500_0004e9e50005718b_2.0.wav,1
Tursiops_truncatus_Echo,57.76689036,78.87402338,21.10713302,12/1/2017,2017-12-01T024500_0004e9e50005718b_2.0.wav,2
Tursiops_truncatus_Echo,109.4238212,130.2532288,20.82940758,12/1/2017,2017-12-01T024500_0004e9e50005718b_2.0.wav,3
Bairdiella_chrysoura,280.2249634,296.3330385,16.1080752,12/1/2017,2017-12-01T024500_0004e9e50005718b_2.0.wav,4
Tursiops_truncatus_Echo,137.744636,158.0260548,20.2814188,12/1/2017,2017-12-01T025000_0004e9e50005718b_2.0.wav,2
Bairdiella_chrysoura,177.4624145,201.1240698,23.66165527,12/1/2017,2017-12-01T025000_0004e9e50005718b_2.0.wav,3
Unknown,226.1941569,246.757262,20.56310517,12/1/2017,2017-12-01T025000_0004e9e50005718b_2.0.wav,4
Tursiops_truncatus_Echo,95.86337911,111.9345927,16.07121356,12/1/2017,2017-12-01T025500_0004e9e50005718b_2.0.wav,1
Tursiops_truncatus_Echo,154.509211,172.8360335,18.32682248,12/1/2017,2017-12-01T025500_0004e9e50005718b_2.0.wav,2
Tursiops_truncatus_Echo,233.1735721,255.7296613,22.5560892,12/1/2017,2017-12-01T025500_0004e9e50005718b_2.0.wav,3
Tursiops_truncatus_Echo,184.2299678,205.2607861,21.03081824,12/1/2017,2017-12-01T030000_0004e9e50005718b_2.0.wav,1
Tursiops_truncatus_Echo,209.7473606,231.0585898,21.31122915,12/1/2017,2017-12-01T030000_0004e9e50005718b_2.0.wav,2
Tursiops_truncatus_Echo,270.0357062,291.9077572,21.87205097,12/1/2017,2017-12-01T030000_0004e9e50005718b_2.0.wav,3
Bairdiella_chrysoura,103.2911863,123.8929803,20.60179399,12/1/2017,2017-12-01T031000_0004e9e50005718b_2.0.wav,1
Bairdiella_chrysoura,129.5373074,150.4213177,20.88401034,12/1/2017,2017-12-01T031000_0004e9e50005718b_2.0.wav,2
Unknown,218.1532432,242.9882825,24.83503932,12/1/2017,2017-12-01T031000_0004e9e50005718b_2.0.wav,3
Unknown,49.16029079,70.26866424,21.10837345,12/1/2017,2017-12-01T031500_0004e9e50005718b_2.0.wav,1
Unknown,116.3737957,141.6482955,25.27449978,12/1/2017,2017-12-01T031500_0004e9e50005718b_2.0.wav,2
Unknown,198.3076137,223.8598552,25.55224154,12/1/2017,2017-12-01T031500_0004e9e50005718b_2.0.wav,3
Unknown,232.7475914,253.0227396,20.27514818,12/1/2017,2017-12-01T031500_0004e9e50005718b_2.0.wav,4
Ariopsis_felis,271.3536955,293.573036,22.21934047,12/1/2017,2017-12-01T031500_0004e9e50005718b_2.0.wav,5
Unknown,70.28477396,90.57021685,20.28544289,12/1/2017,2017-12-01T040500_0004e9e50005718b_2.0.wav,1
Unknown,39.71375439,60.28490774,20.57115335,12/1/2017,2017-12-01T040500_0004e9e50005718b_2.0.wav,2
Tursiops_truncatus_Echo,1.727424106,39.73075444,38.00333033,12/1/2017,2017-12-01T194000_0004e9e50005718b_2.0.wav,1
Tursiops_truncatus_Echo,88.0986294,107.6615228,19.56289338,12/1/2017,2017-12-01T194000_0004e9e50005718b_2.0.wav,2
Tursiops_truncatus_Echo,163.529482,185.1222834,21.59280132,12/1/2017,2017-12-01T194000_0004e9e50005718b_2.0.wav,4
Tursiops_truncatus_Echo,215.3522052,233.7780623,18.42585713,12/1/2017,2017-12-01T194000_0004e9e50005718b_2.0.wav,6
Tursiops_truncatus_Echo,0,19.59038118,19.59038118,12/1/2017,2017-12-01T222000_0004e9e50005718b_2.0.wav,1
Tursiops_truncatus_Echo,20.46756243,40.0579436,19.59038118,12/1/2017,2017-12-01T222000_0004e9e50005718b_2.0.wav,2
Tursiops_truncatus_Echo,51.16890606,66.37338101,15.20447494,12/1/2017,2017-12-01T222000_0004e9e50005718b_2.0.wav,3
Tursiops_truncatus_Whistle,128.9022522,134.7934525,5.891200354,12/1/2017,2017-12-01T230000_0004e9e50005718b_2.0.wav,1
Opsanus_beta,255.7676741,274.3901214,18.62244726,12/1/2017,2017-12-01T230000_0004e9e50005718b_2.0.wav,2
Ariopsis_felis,9.595356103,29.91493373,20.31957763,12/2/2017,2017-12-02T010500_0004e9e50005718b_2.0.wav,1
Unknown,49.34513421,78.78399269,29.43885848,12/2/2017,2017-12-02T013500_0004e9e50005718b_2.0.wav,1
Unknown,117.7554339,139.9046703,22.14923638,12/2/2017,2017-12-02T013500_0004e9e50005718b_2.0.wav,2
Unknown,175.3269407,185.1123806,9.785439874,12/2/2017,2017-12-02T013500_0004e9e50005718b_2.0.wav,3
Unknown,194.008235,203.2853404,9.277105336,12/2/2017,2017-12-02T013500_0004e9e50005718b_2.0.wav,4
Unknown,278.0105176,286.0167866,8.006268988,12/2/2017,2017-12-02T013500_0004e9e50005718b_2.0.wav,5
Ariopsis_felis,3.216331238,10.23378121,7.017449974,12/2/2017,2017-12-02T020500_0004e9e50005718b_2.0.wav,1
Ariopsis_felis,195.611418,206.137593,10.52617496,12/2/2017,2017-12-02T020500_0004e9e50005718b_2.0.wav,2
Tursiops_truncatus_Whistle,2.923937489,7.894631221,4.970693732,12/2/2017,2017-12-02T220000_0004e9e50005718b_2.0.wav,1
Tursiops_truncatus_Whistle,232.7454241,244.7335678,11.98814371,12/2/2017,2017-12-02T220000_0004e9e50005718b_2.0.wav,4
Bairdiella_chrysoura,50.81546903,63.58875633,12.7732873,12/2/2017,2017-12-02T223000_0004e9e50005718b_2.0.wav,1
Tursiops_truncatus_Echo,232.6379274,249.523255,16.88532756,12/3/2017,2017-12-03T012500_0004e9e50005718b_2.0.wav,1
Tursiops_truncatus_Echo,250.3675213,263.5943613,13.22683992,12/3/2017,2017-12-03T012500_0004e9e50005718b_2.0.wav,2
Tursiops_truncatus_Echo,267.8156931,289.2037747,21.38808158,12/3/2017,2017-12-03T012500_0004e9e50005718b_2.0.wav,3
Tursiops_truncatus_Echo,3.64481105,15.70072452,12.05591347,12/3/2017,2017-12-03T225500_0004e9e50005718b_2.0.wav,1
Tursiops_truncatus_Echo,58.59734688,73.17659107,14.5792442,12/3/2017,2017-12-03T225500_0004e9e50005718b_2.0.wav,2
Tursiops_truncatus_Echo,74.2980714,89.99879592,15.70072452,12/3/2017,2017-12-03T225500_0004e9e50005718b_2.0.wav,3
Unknown,111.0252019,113.2975663,2.272364391,1/3/2018,2018-01-03T194500_0004e9e50005718b_2.0.wav,1
Tursiops_truncatus_Echo,113.4347969,114.601328,1.166531114,1/3/2018,2018-01-03T195000_0004e9e50005718b_2.0.wav,1
Tursiops_truncatus_Echo,116.2037326,121.9619043,5.758171693,1/3/2018,2018-01-03T195000_0004e9e50005718b_2.0.wav,2
Tursiops_truncatus_Echo,124.6965208,125.9020885,1.205567627,1/3/2018,2018-01-03T195000_0004e9e50005718b_2.0.wav,3
Tursiops_truncatus_Echo,4.709213951,6.120848829,1.411634878,1/3/2018,2018-01-03T195500_0004e9e50005718b_2.0.wav,1
Unknown,48.76909736,50.39296643,1.623869072,1/4/2018,2018-01-04T175000_0004e9e50005718b_2.0.wav,1
Unknown,74.77379956,75.72331189,0.949512333,1/4/2018,2018-01-04T175000_0004e9e50005718b_2.0.wav,2
Opsanus_beta,144.6823375,145.2305758,0.548238279,1/5/2018,2018-01-05T175500_0004e9e50005718b_2.0.wav,1
Ariopsis_felis,118.3294509,119.7914196,1.461968745,1/5/2018,2018-01-05T182500_0004e9e50005718b_2.0.wav,1
Ariopsis_felis,283.2644036,286.912155,3.647751417,1/5/2018,2018-01-05T203500_0004e9e50005718b_2.0.wav,1
Tursiops_truncatus_Echo,168.4736358,187.0582484,18.5846126,1/5/2018,2018-01-05T210500_0004e9e50005718b_2.0.wav,1
Tursiops_truncatus_Echo,188.530023,214.0253452,25.49532223,1/5/2018,2018-01-05T210500_0004e9e50005718b_2.0.wav,2
Tursiops_truncatus_Echo,220.8481325,242.2259061,21.3777735,1/5/2018,2018-01-05T210500_0004e9e50005718b_2.0.wav,3
Tursiops_truncatus_Echo,245.0563663,256.3673738,11.3110075,1/5/2018,2018-01-05T210500_0004e9e50005718b_2.0.wav,4
Tursiops_truncatus_Whistle,270.8258865,271.5450075,0.719120973,1/5/2018,2018-01-05T210500_0004e9e50005718b_2.0.wav,5
Tursiops_truncatus_Echo,258.6740581,276.277549,17.60349087,1/5/2018,2018-01-05T210500_0004e9e50005718b_2.0.wav,6
Tursiops_truncatus_Echo,279.8724761,286.4530037,6.580527622,1/5/2018,2018-01-05T210500_0004e9e50005718b_2.0.wav,7
Tursiops_truncatus_Echo,294.6835144,296.7219728,2.038458402,1/5/2018,2018-01-05T210500_0004e9e50005718b_2.0.wav,8
Ariopsis_felis,95.61067191,95.88562993,0.274958019,1/5/2018,2018-01-05T210500_0004e9e50005718b_2.0.wav,10
Tursiops_truncatus_Echo,0,14.8788332,14.8788332,1/5/2018,2018-01-05T211000_0004e9e50005718b_2.0.wav,1
Tursiops_truncatus_Echo,17.053876,32.31679006,15.26291406,1/5/2018,2018-01-05T211000_0004e9e50005718b_2.0.wav,2
Tursiops_truncatus_Whistle,32.3631757,32.68071178,0.317536074,1/5/2018,2018-01-05T211000_0004e9e50005718b_2.0.wav,3
Ariopsis_felis,213.9492622,216.6051608,2.655898662,1/5/2018,2018-01-05T214000_0004e9e50005718b_2.0.wav,1
Tursiops_truncatus_Echo,51.00457606,211.5002187,160.4956427,1/5/2018,2018-01-05T214500_0004e9e50005718b_2.0.wav,1
Tursiops_truncatus_Echo,216.6447181,219.6566328,3.01191474,1/5/2018,2018-01-05T214500_0004e9e50005718b_2.0.wav,4
Tursiops_truncatus_Echo,229.9626071,279.9855958,50.02298868,1/5/2018,2018-01-05T214500_0004e9e50005718b_2.0.wav,5
Tursiops_truncatus_Echo,286.0094253,287.7305194,1.721094137,1/5/2018,2018-01-05T214500_0004e9e50005718b_2.0.wav,6
Unknown,270.8784164,271.9182441,1.039827708,1/5/2018,2018-01-05T214500_0004e9e50005718b_2.0.wav,8
Unknown,118.1638678,119.6608611,1.496993338,1/5/2018,2018-01-05T214500_0004e9e50005718b_2.0.wav,11
Ariopsis_felis,78.0170853,78.65860505,0.641519747,1/5/2018,2018-01-05T215000_0004e9e50005718b_2.0.wav,2
Tursiops_truncatus_Echo,123.0135416,125.5008605,2.487318845,1/5/2018,2018-01-05T215000_0004e9e50005718b_2.0.wav,3
Tursiops_truncatus_Echo,127.8718696,129.0159132,1.144043548,1/5/2018,2018-01-05T215000_0004e9e50005718b_2.0.wav,4
Tursiops_truncatus_Echo,136.0689693,136.6463371,0.577367773,1/5/2018,2018-01-05T215000_0004e9e50005718b_2.0.wav,5
Tursiops_truncatus_Echo,226.0698886,240.077136,14.0072474,1/5/2018,2018-01-05T215000_0004e9e50005718b_2.0.wav,6
Tursiops_truncatus_Echo,245.7323023,253.0155364,7.2832340779999996,1/5/2018,2018-01-05T215000_0004e9e50005718b_2.0.wav,7
Tursiops_truncatus_Echo,273.4764228,283.2746788,9.798256007,1/5/2018,2018-01-05T215000_0004e9e50005718b_2.0.wav,8
Unknown,41.28289471,42.28425988,1.001365164,1/5/2018,2018-01-05T215500_0004e9e50005718b_2.0.wav,1
Tursiops_truncatus_Echo,114.6840426,115.8055716,1.121528984,1/5/2018,2018-01-05T215500_0004e9e50005718b_2.0.wav,2
Tursiops_truncatus_Echo,165.8611726,171.9494728,6.088300197,1/5/2018,2018-01-05T215500_0004e9e50005718b_2.0.wav,3
Tursiops_truncatus_Echo,172.8707288,180.8816501,8.010921311,1/5/2018,2018-01-05T215500_0004e9e50005718b_2.0.wav,4
Tursiops_truncatus_Echo,184.945185,190.5528299,5.607644917,1/5/2018,2018-01-05T215500_0004e9e50005718b_2.0.wav,5
Tursiops_truncatus_Echo,11.6183815,23.04070097,11.42231947,1/5/2018,2018-01-05T220000_0004e9e50005718b_2.0.wav,1
Tursiops_truncatus_Echo,24.92617019,41.96892024,17.04275005,1/5/2018,2018-01-05T220000_0004e9e50005718b_2.0.wav,2
Tursiops_truncatus_Whistle,33.17432823,33.71901934,0.544691107,1/5/2018,2018-01-05T220000_0004e9e50005718b_2.0.wav,3
Tursiops_truncatus_Echo,43.71108745,58.99491644,15.28382899,1/5/2018,2018-01-05T220000_0004e9e50005718b_2.0.wav,4
Tursiops_truncatus_Echo,60.48858021,92.25106098,31.76248077,1/5/2018,2018-01-05T220000_0004e9e50005718b_2.0.wav,5
Tursiops_truncatus_Echo,96.63621021,97.64353808,1.007327874,1/5/2018,2018-01-05T220000_0004e9e50005718b_2.0.wav,6
Tursiops_truncatus_Echo,109.8463418,118.0586077,8.212265915,1/5/2018,2018-01-05T220000_0004e9e50005718b_2.0.wav,7
Tursiops_truncatus_Echo,120.105632,125.9715362,5.865904226,1/5/2018,2018-01-05T220000_0004e9e50005718b_2.0.wav,8
Tursiops_truncatus_Echo,133.7576851,196.1829406,62.42525558,1/5/2018,2018-01-05T220000_0004e9e50005718b_2.0.wav,9
Tursiops_truncatus_Echo,200.418967,206.9396723,6.52070532,1/5/2018,2018-01-05T220000_0004e9e50005718b_2.0.wav,10
Tursiops_truncatus_Echo,209.6878961,217.8661788,8.178282768,1/5/2018,2018-01-05T220000_0004e9e50005718b_2.0.wav,11
Tursiops_truncatus_Echo,225.1779944,230.6383466,5.460352242,1/5/2018,2018-01-05T220000_0004e9e50005718b_2.0.wav,13
Tursiops_truncatus_Echo,243.5648155,253.3424676,9.777652048,1/5/2018,2018-01-05T220000_0004e9e50005718b_2.0.wav,14
Tursiops_truncatus_Echo,255.0548868,259.1138256,4.058938784,1/5/2018,2018-01-05T220000_0004e9e50005718b_2.0.wav,15
Tursiops_truncatus_Echo,264.9585051,294.3767574,29.41825227,1/5/2018,2018-01-05T220000_0004e9e50005718b_2.0.wav,16
Tursiops_truncatus_Echo,0.568572407,36.69876447,36.13019206,1/5/2018,2018-01-05T220500_0004e9e50005718b_2.0.wav,1
Unknown,37.49000106,37.92935247,0.439351406,1/5/2018,2018-01-05T220500_0004e9e50005718b_2.0.wav,2
Unknown,54.59238697,55.26433618,0.671949209,1/5/2018,2018-01-05T220500_0004e9e50005718b_2.0.wav,3
Tursiops_truncatus_Echo,166.0643213,175.2830237,9.218702451,1/5/2018,2018-01-05T220500_0004e9e50005718b_2.0.wav,4
Tursiops_truncatus_Echo,187.9113017,215.5129077,27.60160595,1/5/2018,2018-01-05T220500_0004e9e50005718b_2.0.wav,5
Tursiops_truncatus_Echo,233.2737302,257.7188983,24.44516813,1/5/2018,2018-01-05T220500_0004e9e50005718b_2.0.wav,6
Tursiops_truncatus_Echo,262.0930049,281.0626479,18.96964304,1/5/2018,2018-01-05T220500_0004e9e50005718b_2.0.wav,7
Tursiops_truncatus_Echo,288.0929205,299.9959864,11.9030659,1/5/2018,2018-01-05T220500_0004e9e50005718b_2.0.wav,9
Unknown,3.770441359,5.368780631,1.598339272,2/1/2018,2018-02-01T014000_0004e9e50005718b_2.0.wav,1
Cynoscion_nebulosus,195.6910786,198.5723919,2.881313368,2/1/2018,2018-02-01T014500_0004e9e50005718b_2.0.wav,1
Cynoscion_nebulosus,195.6910786,198.5723919,2.881313368,2/1/2018,2018-02-01T014500_0004e9e50005718b_2.0.wav,1
Opsanus_beta,31.38758763,32.37118103,0.983593398,2/1/2018,2018-02-01T023500_0004e9e50005718b_2.0.wav,1
Ariopsis_felis,213.6187462,214.3974243,0.778678107,2/1/2018,2018-02-01T023500_0004e9e50005718b_2.0.wav,3
Cynoscion_nebulosus,184.8126831,186.6430158,1.830332655,2/1/2018,2018-02-01T033000_0004e9e50005718b_2.0.wav,1
Ariopsis_felis,196.5380237,206.0460932,9.508069514,2/1/2018,2018-02-01T033500_0004e9e50005718b_2.0.wav,1
Unknown,59.85422346,60.55255673,0.698333271,2/1/2018,2018-02-01T034500_0004e9e50005718b_2.0.wav,1
Unknown,62.62204357,63.27662018,0.654576608,2/1/2018,2018-02-01T034500_0004e9e50005718b_2.0.wav,2
Unknown,63.69345781,64.54166075,0.848202938,2/1/2018,2018-02-01T034500_0004e9e50005718b_2.0.wav,3
Cynoscion_nebulosus,18.57510847,20.25591357,1.680805107,2/1/2018,2018-02-01T212000_0004e9e50005718b_2.0.wav,1
Cynoscion_nebulosus,174.8740163,177.5544365,2.680420159,2/1/2018,2018-02-01T213000_0004e9e50005718b_2.0.wav,1
Cynoscion_nebulosus,229.5065569,231.3137587,1.807201858,2/1/2018,2018-02-01T213500_0004e9e50005718b_2.0.wav,1
Opsanus_beta,219.0879693,219.6726701,0.584700809,2/2/2018,2018-02-02T035000_0004e9e50005718b_2.0.wav,1
Opsanus_beta,3.363437441,3.749874934,0.386437493,2/2/2018,2018-02-02T035000_0004e9e50005718b_2.0.wav,3
Unknown,35.77933763,36.43579226,0.656454634,2/2/2018,2018-02-02T035500_0004e9e50005718b_2.0.wav,1
Unknown,37.32503223,38.95918526,1.634153027,2/2/2018,2018-02-02T035500_0004e9e50005718b_2.0.wav,3
Bairdiella_chrysoura,106.108084,108.8734327,2.765348651,2/2/2018,2018-02-02T035500_0004e9e50005718b_2.0.wav,4
Bairdiella_chrysoura,165.6685803,171.5701407,5.901560388,2/2/2018,2018-02-02T035500_0004e9e50005718b_2.0.wav,5
Bairdiella_chrysoura,183.7078317,186.3307475,2.622915728,2/2/2018,2018-02-02T035500_0004e9e50005718b_2.0.wav,6
Bairdiella_chrysoura,191.1667483,193.5437657,2.377017378,2/2/2018,2018-02-02T035500_0004e9e50005718b_2.0.wav,7
Bairdiella_chrysoura,195.9274588,198.3864423,2.458983495,2/2/2018,2018-02-02T035500_0004e9e50005718b_2.0.wav,8
Bairdiella_chrysoura,205.004738,207.7143118,2.709573751,2/2/2018,2018-02-02T035500_0004e9e50005718b_2.0.wav,9
Bairdiella_chrysoura,211.6431829,213.9760245,2.332841571,2/2/2018,2018-02-02T035500_0004e9e50005718b_2.0.wav,10
Bairdiella_chrysoura,220.815009,222.9160154,2.101006384,2/2/2018,2018-02-02T035500_0004e9e50005718b_2.0.wav,11
Bairdiella_chrysoura,224.9300836,226.4659917,1.535908116,2/2/2018,2018-02-02T035500_0004e9e50005718b_2.0.wav,12
Bairdiella_chrysoura,231.3461682,233.1139115,1.767743302,2/2/2018,2018-02-02T035500_0004e9e50005718b_2.0.wav,13
Bairdiella_chrysoura,237.7627888,239.5015527,1.738763904,2/2/2018,2018-02-02T035500_0004e9e50005718b_2.0.wav,14
Bairdiella_chrysoura,244.3477351,246.7240458,2.376310669,2/2/2018,2018-02-02T035500_0004e9e50005718b_2.0.wav,15
Bairdiella_chrysoura,248.2019951,249.4625989,1.26060383,2/2/2018,2018-02-02T035500_0004e9e50005718b_2.0.wav,16
Bairdiella_chrysoura,256.7797434,258.5619765,1.782233002,2/2/2018,2018-02-02T035500_0004e9e50005718b_2.0.wav,17
Bairdiella_chrysoura,262.4307261,263.981124,1.550397814,2/2/2018,2018-02-02T035500_0004e9e50005718b_2.0.wav,18
Bairdiella_chrysoura,265.8823367,267.3168169,1.434480221,2/2/2018,2018-02-02T035500_0004e9e50005718b_2.0.wav,19
Bairdiella_chrysoura,279.5146739,282.8473047,3.332630816,2/2/2018,2018-02-02T035500_0004e9e50005718b_2.0.wav,20
Bairdiella_chrysoura,291.3064183,293.392935,2.086516685,2/2/2018,2018-02-02T035500_0004e9e50005718b_2.0.wav,21
Bairdiella_chrysoura,296.812504,297.3540199,0.541515933,2/2/2018,2018-02-02T035500_0004e9e50005718b_2.0.wav,22
Bairdiella_chrysoura,2.89793984,5.679962087,2.782022247,2/2/2018,2018-02-02T040000_0004e9e50005718b_2.0.wav,1
Bairdiella_chrysoura,9.776654914,13.41499909,3.63834418,2/2/2018,2018-02-02T040000_0004e9e50005718b_2.0.wav,2
Bairdiella_chrysoura,50.81152629,52.82556343,2.014037142,2/2/2018,2018-02-02T040000_0004e9e50005718b_2.0.wav,3
Bairdiella_chrysoura,55.86123711,58.11433469,2.253097583,2/2/2018,2018-02-02T040000_0004e9e50005718b_2.0.wav,4
Bairdiella_chrysoura,64.59830025,66.17060744,1.572307193,2/2/2018,2018-02-02T040000_0004e9e50005718b_2.0.wav,5
Bairdiella_chrysoura,69.30038247,71.32894036,2.028557888,2/2/2018,2018-02-02T040000_0004e9e50005718b_2.0.wav,6
Bairdiella_chrysoura,73.35749825,75.36918907,2.011690818,2/2/2018,2018-02-02T040000_0004e9e50005718b_2.0.wav,7
Bairdiella_chrysoura,104.6499172,107.3061317,2.656214463,2/2/2018,2018-02-02T040000_0004e9e50005718b_2.0.wav,8
Bairdiella_chrysoura,111.4132196,114.2929558,2.879736229,2/2/2018,2018-02-02T040000_0004e9e50005718b_2.0.wav,9
Bairdiella_chrysoura,136.9812856,138.9217011,1.940415484,2/2/2018,2018-02-02T040000_0004e9e50005718b_2.0.wav,10
Bairdiella_chrysoura,142.6954948,144.7936811,2.098186215,2/2/2018,2018-02-02T040000_0004e9e50005718b_2.0.wav,11
Bairdiella_chrysoura,148.2914941,150.9477086,2.656214463,2/2/2018,2018-02-02T040000_0004e9e50005718b_2.0.wav,12
Bairdiella_chrysoura,158.8423415,161.6548038,2.812462372,2/2/2018,2018-02-02T040000_0004e9e50005718b_2.0.wav,13
Bairdiella_chrysoura,165.46683,166.833306,1.366476001,2/2/2018,2018-02-02T040000_0004e9e50005718b_2.0.wav,14
Bairdiella_chrysoura,219.4835054,222.8763171,3.392811751,2/2/2018,2018-02-02T040000_0004e9e50005718b_2.0.wav,15
Bairdiella_chrysoura,229.031044,232.0890388,3.057994801,2/2/2018,2018-02-02T040000_0004e9e50005718b_2.0.wav,16
Bairdiella_chrysoura,245.3145204,246.8769994,1.562479096,2/2/2018,2018-02-02T040000_0004e9e50005718b_2.0.wav,17
Tursiops_truncatus_Echo,23.38659886,28.2419481,4.855349244,2/2/2018,2018-02-02T040500_0004e9e50005718b_2.0.wav,1
Tursiops_truncatus_Echo,250.0139216,251.9358307,1.921909076,2/2/2018,2018-02-02T040500_0004e9e50005718b_2.0.wav,2
Bairdiella_chrysoura,11.15943523,12.99342709,1.833991857,2/2/2018,2018-02-02T045000_0004e9e50005718b_2.0.wav,1
Bairdiella_chrysoura,21.73647955,23.38604764,1.649568094,2/2/2018,2018-02-02T045000_0004e9e50005718b_2.0.wav,2
Bairdiella_chrysoura,25.55123005,28.00509066,2.453860613,2/2/2018,2018-02-02T045000_0004e9e50005718b_2.0.wav,3
Bairdiella_chrysoura,37.731735810000004,37.83419345,0.102457646,2/2/2018,2018-02-02T045000_0004e9e50005718b_2.0.wav,4
Bairdiella_chrysoura,39.12515979,39.71941413,0.594254344,2/2/2018,2018-02-02T045000_0004e9e50005718b_2.0.wav,5
Bairdiella_chrysoura,48.37196383,49.80637087,1.434407039,2/2/2018,2018-02-02T045000_0004e9e50005718b_2.0.wav,6
Bairdiella_chrysoura,105.1730513,105.3036848,0.130633498,2/2/2018,2018-02-02T045000_0004e9e50005718b_2.0.wav,7
Bairdiella_chrysoura,177.6750483,179.6058007,1.930752419,2/2/2018,2018-02-02T045000_0004e9e50005718b_2.0.wav,8
Bairdiella_chrysoura,222.6606458,225.1782311,2.517585236,2/2/2018,2018-02-02T045000_0004e9e50005718b_2.0.wav,9
Bairdiella_chrysoura,229.9165342,231.9487145,2.032180313,2/2/2018,2018-02-02T045000_0004e9e50005718b_2.0.wav,10
Bairdiella_chrysoura,235.4890499,236.5975119,1.108461989,2/2/2018,2018-02-02T045000_0004e9e50005718b_2.0.wav,11
Unknown,283.7819987,299.6834253,15.9014266,2/2/2018,2018-02-02T050500_0004e9e50005718b_2.0.wav,1
Unknown,0,36.05037161,36.05037161,2/2/2018,2018-02-02T051000_0004e9e50005718b_2.0.wav,1
Opsanus_beta,142.4771033,142.9407737,0.463670375,2/2/2018,2018-02-02T052000_0004e9e50005718b_2.0.wav,1
